BankURL,UserName,ReviewRating,UserLocation,ReviewTitle,comments,ReviewDate
www.dugood.org,Ruth Peck,4,US,I am having a very hard time enrolling…,I am having a very hard time enrolling in online banking and trying to enroll in the app.It states something I entered in registering is incorrect but there isn't anything incorrect. I am unabe to leave my job to get someone to help me. Its frustrating.,"Date of experience: October 25, 2018"
www.dugood.org,Teresa,5,US,Darlene made my husband and I feel like…,Darlene made my husband and I feel like part of the family.  She was extremely helpful through the whole process.,"Date of experience: October 22, 2018"
www.dugood.org,John,5,US,The company and all of the employees…,The company and all of the employees that I came in contact with made me feel like a member of the company and not just a person whose money is being stored at the bank.,"Date of experience: October 22, 2018"
www.dugood.org,Connie,5,US,Wonderful caring staff,,"Date of experience: October 22, 2018"
www.dugood.org,COREY,5,US,Our member services rep was extremely…,Our member services rep was extremely friendly and a joy to work with.,"Date of experience: October 19, 2018"
www.dugood.org,Tammy,5,US,Thank  you  so  very  much  for  all …,Thank  you  so  very  much  for  all  you  did  to help  me  and  my  daughter.,"Date of experience: October 19, 2018"
www.dugood.org,Joline,5,US,Scott At The Lumberton Branch,"Your employee, Scott, at your Lumberton branch was courteous, helpful and a delight to have help me open my accounts.","Date of experience: October 18, 2018"
www.dugood.org,Angela,5,US,Kristin was very informational and…,Kristin was very informational and helpful..,"Date of experience: October 15, 2018"
www.dugood.org,Holly,5,US,DuGood cares about their members,"I love DuGood, they care about their members.  I attended the free seminar/luncheon that DuGood provided about Social Security at The Schooner.  Received some good information.  I have been with DuGood 35+ years & hopefully will live to have 35+ more :) Many thanks to Ronda & all the folks at the Orange Branch!","Date of experience: October 15, 2018"
www.dugood.org,Dani,5,US,Blown away with the response time to…,Blown away with the response time to our questions and setting us up with our refi for our vehicle! Very friendly and honest. Loved that there was no smoke and mirrors or upselling of other products. The whole process was simple and straightforward. Thanks so much!!!,"Date of experience: October 15, 2018"
www.dugood.org,Alaycia,5,US,Anxiety Friendly,"From the moment I stepped into the building, I felt very welcomed. Each employee was so nice and courteous, and getting my account set up was so easy. The person that helped me gave me the best advice and made sure I thoroughly understood everything by the time I was done. Even better, I honestly believe this is the credit union to join if you have any form of anxiety. As a person who personally suffers from social anxiety, I have never felt more comfortable in years. I highly reccommend becoming a DuGood member.","Date of experience: October 15, 2018"
www.dugood.org,Cody,5,US,Service was fantastic and everyone…,Service was fantastic and everyone seems to care about your buisness!I plan to be a longtime member.,"Date of experience: October 15, 2018"
www.dugood.org,Leslie,4,US,Almost painless,"Almost painless.  My loan officer was very kind, understanding, then quickly worked to determine how she might help me. I had her full attention, until my business was completed. I felt quit comfortable as I was walked thru the process.","Date of experience: October 12, 2018"
www.dugood.org,Sadie Reese,5,US,The lady I was speaking to was so kind…,The lady I was speaking to was so kind and ready to help me get my account set it up . I think it’s going to be great banking with you guys .,"Date of experience: October 11, 2018"
www.dugood.org,Joel,4,US,I refinance my truck note and it was a…,I refinance my truck note and it was a very easy. I have been with dugood for years and always easy to deal with. I will be there for my lifespan.,"Date of experience: October 08, 2018"
www.dugood.org,Richard,4,US,From the beginning,"From the beginning, they helped explain the process and everything went as planned.","Date of experience: October 08, 2018"
www.dugood.org,Toni,4,US,Typically get great service,"Typically get great service. Jasper office is, by far, our favorite with friendly at.","Date of experience: October 08, 2018"
www.dugood.org,Jill,5,US,Very helpful and friendly employees,"Very helpful and friendly employees, trusted credit union.","Date of experience: October 08, 2018"
www.dugood.org,Cheryl,5,US,Great employees who really helped solve…,Great employees who really helped solve all our issues.,"Date of experience: October 07, 2018"
www.dugood.org,Gerald,5,US,Friendly helpful and infomative…,Friendly helpful and infomative experiance!,"Date of experience: October 05, 2018"
www.dugood.org,Arthur,5,US,What I can say is that DuGood Credit…,"What I can say is that DuGood Credit Union is a pleasure to work with. They do what they say, when they say they will. It was very refreshing.","Date of experience: October 03, 2018"
www.dugood.org,Leslie,5,US,These folks are great!,"These folks are great. I've been a member since the 1980's. I've never had a problem that wasn't handled correctly, promptly and professionally. I've used many of their services and everything about them is top-notch.","Date of experience: October 03, 2018"
www.dugood.org,Greg,5,US,Our family has trusted DuGood CU for…,Our family has trusted DuGood CU for many years. The service is excellent and we have never had a single issue conducting business with them.,"Date of experience: September 28, 2018"
www.dugood.org,Chase,5,US,Auto Loan,"Excellent customer service when I was getting an auto loan. The process was simple, quick, and painless. 10/10 would recommend.","Date of experience: September 22, 2018"
www.dugood.org,Lisa,5,US,Jennifer in the Jasper office was very…,Jennifer in the Jasper office was very helpful. She answered all my questions and helped me set up my savings account.,"Date of experience: September 21, 2018"
www.dugood.org,Damarrious,3,US,Good service,,"Date of experience: September 21, 2018"
www.dugood.org,Jonas,5,US,I would recmmend DuGood to anyone is…,I would recmmend DuGood to anyone is really good company and they people is really nice thanks. J. Camacho,"Date of experience: September 21, 2018"
www.dugood.org,Pashion,5,US,Customers service was so good and…,Customers service was so good and everything went so smoothly. They told me what I needed and I provided and the rest was done. Thanks,"Date of experience: September 18, 2018"
www.dugood.org,Nicholas,5,US,I've used DuGood for many years,"I've used DuGood for many years and have always been happy with their service and responsiveness.  Their loan process is quick, easy, and always fair with rates or fees.  They generally will match a competitor's rate with no hassel or extra conditions.  It's a good outfit.","Date of experience: September 14, 2018"
www.dugood.org,Donna,5,US,I have been a customer for for 36…,I have been a customer for  36 years. They have been there for me in the past and are still there when I need them today.,"Date of experience: September 13, 2018"
www.dugood.org,Remick,5,US,Dugood credit union was very nice and…,Dugood credit union was very nice and help me get a car loan transfered quickly and easily. They are always pleasant and curtious to me.,"Date of experience: September 10, 2018"
www.dugood.org,Donald,5,US,Service was excellent!,,"Date of experience: September 08, 2018"
www.dugood.org,Candice,1,US,Deposited wrong amount to checking and savings accounts,I opened a new account on 9/1/18 and they messed up the very first deposit I made. They deposited the wrong amount to both the checking and savings accounts. Not a good way to start off a banking relationship. I am very skeptical about keeping money at this credit union. Especially large amounts of money.Update: (6 weeks later on 10/26/18)Customer service means everything. How a business treats their customers says a lot about them. Dugood is the worst credit union in Southeast Texas. I wish I could give them 0 stars!,"Date of experience: September 07, 2018"
www.dugood.org,Terry,5,US,Excellent customer service,"Excellent customer service, even when I'm melting down because I was an emotional wreck that day she never lost her cool and actually calmed me down before I got off the phone.  I got what I needed (although not what I really wanted) and can move forward with my home rwpairs.","Date of experience: August 30, 2018"
www.dugood.org,Christopher,5,US,I just like the way I was treated and I…,I just like the way I was treated and I like the way everything was handled,"Date of experience: August 29, 2018"
www.dugood.org,James,5,US,The customer service was excellent she…,The customer service was excellent she took time to explain everything and even play with our daughter,"Date of experience: August 28, 2018"
www.dugood.org,Leslie,5,US,DuGood is a great place to do banking,DuGood is a great place to do banking. They are completely knowledgeable and helpful. They are always willing to help me with my needs. I am a customer for life.,"Date of experience: August 27, 2018"
www.dugood.org,Brent,4,US,Seems to be a really great group of…,Seems to be a really great group of people.,"Date of experience: August 26, 2018"
www.dugood.org,Jacqueline,5,US,DuGood Credit Union  is a great place to do business,"DuGood Credit Union  is excellent in every way in my book!  All the personnel that I have dealt with are friendly, courteous and knowledgeable!","Date of experience: August 23, 2018"
www.dugood.org,Edwin,5,US,DuGood is a great place to bank,"DuGood is a great place to bank, I was looking at making a purchase and decided to get a loan. I applied on line and was approve the same day, the process was very fast and was all done on line great people to do business with","Date of experience: August 22, 2018"
www.dugood.org,Randall Collier,5,US,I am completely satisfied with the personalized Service I received,"I am completely satisfied with the service I received from Elizabeth Thomas, she worked very hard to get my current loans handled in as shortest time as possible.  I would recommend Elizabeth and Du Good Credit Union to anyone looking for a bank and a place to get a loan.","Date of experience: August 20, 2018"
www.dugood.org,Kathy,5,US,A great place to do business,A great place to do business. In my time of need they were there. Made my experience quick and painless. I would certainly tell my friends to go to dugood if need a helping hand. Thanks dugood.,"Date of experience: August 20, 2018"
www.dugood.org,Elroy,5,US,Thanks for the excellent service,"Thanks for the excellent service, I'm very pleased with how you all treated me after so many years.","Date of experience: August 17, 2018"
www.dugood.org,Bj Berry,5,US,DuGood has been extremely loyal to me…,DuGood has been extremely loyal to me and easy to work with for over 25 years. They truly treat you like family Brent Berry,"Date of experience: August 12, 2018"
www.dugood.org,Dawn,5,US,Great experience everytime,Great experience everytime! They make financing so easy and painless!,"Date of experience: August 12, 2018"
www.dugood.org,John,5,US,Money market,The employees were very nice and friendly. Help me set up a money market account and they was very knowledgeable and answer all of my questions.,"Date of experience: August 11, 2018"
www.dugood.org,Andril,5,US,Quality service,I needed to take a loan for a home improvement project. Called in completed everything over the phone. With in three hours it was approved and money in my account. Amazing and great friendly service.,"Date of experience: August 10, 2018"
www.dugood.org,Bradley,5,US,"DuGood, Orange TX Branch",DuGood had been great to me and my family. I highly recommend them. The staff where from my branch are extremely friendly!!!,"Date of experience: August 10, 2018"
www.dugood.org,Jabari,5,US,This is the best and most trustworthy…,This is the best and most trustworthy bank.,"Date of experience: August 09, 2018"
www.dugood.org,Whitney,5,US,My family has been using DuGood for 20+…,My family has been using DuGood for 20+ years. I just financed my first vehicle through them using Ronda H. SHE IS AMAZING,"Date of experience: August 09, 2018"
www.dugood.org,Dhaval,4,US,Car Loan,I opened my Car loan financing with the Dugood credit union and my experience with them is pretty good till now.,"Date of experience: August 09, 2018"
www.dugood.org,Stephanie,5,US,Always great service with a smile!,,"Date of experience: August 09, 2018"
www.dugood.org,Melissa,5,US,Dollie was awesome in helping me set up…,Dollie was awesome in helping me set up accounts for my business and personal banking.  I look forward to working with DuGood for years to come!,"Date of experience: August 09, 2018"
www.dugood.org,Micah,5,US,I worked with Raven Burton on my auto…,I worked with Raven Burton on my auto loan. She was very courteous and patient throughout the entire process. I was very please with my service.,"Date of experience: August 07, 2018"
www.dugood.org,James,5,US,Always helpful,"Always helpful, courteous, and going the extra mile to help achieve great results!  DuGood will do you good!!","Date of experience: August 04, 2018"
www.dugood.org,Fredricka,5,US,It's an amazing business,,"Date of experience: August 04, 2018"
www.dugood.org,Lisa,5,US,Awesome....except did not have DuGood…,Awesome....except did not have DuGood pens to sign with at main branch in Bmt,"Date of experience: August 03, 2018"
www.dugood.org,Michael,5,US,Great Service,Some of the best customer see ice I have received.,"Date of experience: July 30, 2018"
www.dugood.org,Glenn,5,US,loan,great helpful with loan application,"Date of experience: July 28, 2018"
www.dugood.org,Sadie,5,US,Always kind and courteous!!,,"Date of experience: July 27, 2018"
www.dugood.org,Sarina,5,US,Very friendly and prompt!!!,,"Date of experience: July 17, 2018"
www.dugood.org,Clancy,5,US,Lumberton du good rocks!!,Everyone was super friendly !! Answered and questions me and my husband had ! And set everything up so it was easy to access!,"Date of experience: July 17, 2018"
www.dugood.org,Gilbert,5,US,Always very helpful and polite,Always very helpful and polite. Refinanced my truck and was in and out on no time. Thanks DuGood FCU,"Date of experience: July 10, 2018"
www.dugood.org,Trisha Bertrand,5,US,Fast and Friendly Service,I went in DuGood for assistance and had the best experience! Kristin at the Orange Branch is very friendly and knows what she is doing! Why hasn't someone made her the Branch Manager in Orange yet?!--Trisha,"Date of experience: July 09, 2018"
www.dugood.org,Jimmie,5,US,Dugood did Very Good,"Dugood did Very Good. You folks have always been top shelf. Courteus, professional, helpful and thorough. Great follow through on communication through conclusion. You work with customer make it happen. Thanks.Jimmie Mitchell.","Date of experience: July 09, 2018"
www.dugood.org,Cedric,5,US,I have been banking with Dugood for…,I have been banking with Dugood for almost six years. My Jasper branch is very nice and helpful. I have gotten share loans in the past to build a relationship. I was turned down for a debt consolation loan and was very disappointed. I wanted answers so I emailed the V.P of lending. He was glad I did we crunched the numbers and got my loan. They have a life long customer.Thanks Cedric,"Date of experience: July 08, 2018"
www.dugood.org,Anthony,5,US,Thanks for giving me a chance to grow…,Thanks for giving me a chance to grow financially....,"Date of experience: July 08, 2018"
www.dugood.org,Madonna griffith,5,US,"love my dugood,just bought a van","love my dugood,just bought a van, great experience.","Date of experience: July 08, 2018"
www.dugood.org,Egbert,5,US,I have no complaints,I have no complaints. Service was great. Very friendly and helpful.,"Date of experience: July 07, 2018"
www.dugood.org,John,5,US,We have always had the best experience,We have always had the best experience. Always walk in to smiling faces and friendly people always ready to help us. What ever our needs have been. Thanks for being our prefered banking establishment. John and Susan Hebert,"Date of experience: July 05, 2018"
www.dugood.org,Nicole,5,US,I love banking with DuGood,I love banking with DuGood. They are always very friendly and efficient.  I have no complaints when it comes to my experiences doing business with them.,"Date of experience: July 05, 2018"
www.dugood.org,Dewayne,5,US,I can go in there any time they know my…,I can go in there any time they know my name and are very helpful in Orange,"Date of experience: July 05, 2018"
www.dugood.org,Larry,5,US,Every one is kind and the service was…,Every one is kind and the service was great and fast.,"Date of experience: July 05, 2018"
www.dugood.org,Douglas,5,US,My account opening was a very pleasant…,"My account opening was a very pleasant experience all round. I entered my information on the DuGood online website at my own pace in the comfort of my home. During my visit at the DuGood FCU conveniently located in the building I work in, the people there treated me more like a family member than a customer. Only took a few minutes during my lunch break.","Date of experience: July 04, 2018"
www.dugood.org,Theresa,5,US,Prompt and courteous,Prompt and courteous! Thanks!,"Date of experience: June 19, 2018"
www.dugood.org,Ivy,5,US,It was amazing when I went to the…,It was amazing when I went to the credit Union they really helped me out so much,"Date of experience: June 15, 2018"
www.dugood.org,Denise,5,US,I was banking at 5 point for over 20…,I was banking at 5 point for over 20 years When my husband was unexpectedly retired and I asked for help 5 point told me to find another credit union.I'm so glad I did ! Brenda Franks helped us by restructuring our debt.She didn't know us but she helped us. I will be forever grateful. Thank you DuGood,"Date of experience: June 06, 2018"
www.dugood.org,Bev,5,US,Happy with Dugood,Everything I ever tried to do at Dugood was handled very professionally and caring.,"Date of experience: June 04, 2018"
www.dugood.org,Wanda,5,US,Dugood,Very pleasant.,"Date of experience: May 24, 2018"
www.dugood.org,Kevin,5,US,Dugood is the best I love it thank you,,"Date of experience: May 23, 2018"
www.dugood.org,Tricia,5,US,Banking the easy way!,I've been with DUGOOD right at 2 years. They are simply amazing! Any time I have a question they answer it fully! They make every transaction fast and without error. I work for a bank but I refuse to bank Any where except DUGOOD!,"Date of experience: May 23, 2018"
www.dugood.org,Teresa,5,US,Friendly Service,The staff are very friendly and helpful,"Date of experience: May 22, 2018"
www.dugood.org,Robert,5,US,My experience was very good,My experience was very good. Quickly taken care of and questions answered !,"Date of experience: May 22, 2018"
www.dugood.org,TexasKT,3,US,I don't like their policies when it…,"I don't like their policies when it comes to how they handle transactions.  I find that they will charge an NSF Fee based on a pending transaction without giving you time to deposit money to cover it, and will not refund the fee.  I'm switching...","Date of experience: May 21, 2018"
www.dugood.org,Willie,5,US,Always excellent service!!,,"Date of experience: May 21, 2018"
www.dugood.org,Michael,5,US,Easy to work with,"Easy to work with, efficient .","Date of experience: May 20, 2018"
www.dugood.org,Natalie,5,US,I love it very nice people,,"Date of experience: May 20, 2018"
www.dugood.org,Jennifer,5,US,Excellent banking with DuGood,"Excellent banking with DuGood. I really like the fact that when I am out of town, if I use my card and the bank recognizes the transactions as not in my general area, they call to make sure its me using the card...to prevent fraud! The last time, it took literally 5 minutes for them to call me to make sure. Its very much appreciated because I have had several hundred dollars taken out of my previous bank without knowing for a few days.","Date of experience: May 20, 2018"
www.dugood.org,Lynwood,5,US,this is the best financial institution…,this is the best financial institution i have ever used and the branch manager Megan Perdue is the best branch manager there is.  She knows your needs and works with you until it is to your satisfaction,"Date of experience: May 20, 2018"
www.dugood.org,Sidney,5,US,This is a good bank to be a part of I'm…,This is a good bank to be a part of I'm looking forward to keep doing business with you,"Date of experience: May 20, 2018"
www.dugood.org,Janice,5,US,Excellent service,,"Date of experience: May 20, 2018"
www.dugood.org,Patricia,5,US,Very friendly,"Very friendly,  knowledgable staff","Date of experience: May 19, 2018"
www.dugood.org,Carol,4,US,My experiences with DugGood have been…,My experiences with DugGood have been very good.,"Date of experience: May 19, 2018"
www.dugood.org,Eva,5,US,Employees are very knowledgeable of the…,Employees are very knowledgeable of the services they offer.  They are courteous and helpful.,"Date of experience: May 19, 2018"
www.dugood.org,Donnie,5,US,Good banking,,"Date of experience: May 19, 2018"
www.dugood.org,Patricia,5,US,All of the employees are very welcoming…,"All of the employees are very welcoming when you enter the facility.  The tellers are friendly and helpful, and have considerable knowledge of the services offered.  I would recommend DuGood Credit Union to anyone looking for a new financial institution.","Date of experience: May 18, 2018"
www.dugood.org,Dwayne,5,US,Opened an account and applied for loan…,Opened an account and applied for loan on RV same time.  After the initial account information all communication/information/paperwork was done via E-mail -- even sent loan docs for signing.  Loan was approved next day -- effortless.  Brandi Campbell is a rock star -- can't be more pleased with DuGood CU.   Dwayne,"Date of experience: May 18, 2018"
www.dugood.org,Michael,5,US,Great service!,,"Date of experience: May 18, 2018"
www.dugood.org,Geraldine (Jerry),5,US,Member for over 30 years.....and counting!,I have been a member of DuGood Credit Union for over 30 years!  That fact alone shows that I am very pleased with all of the services they offer.  But a business establishment is not just about the business aspects...that's just 'numbers'.......it's the human element that counts!!  I have made numerous CU friends over the years and at one time was an active part of the fund raising with Children's Miracle network.  When my mother passed (also a long term member) two of our CU friends very graciously attended the funeral to show their respects!  That really touched my heart!  The name DuGood says it all......do good!  I am very proud to be a member and will remain one forever.  I now live about 200 miles away from Beaumont and there are plenty of other banking establishments close by....but I want my DuGood!  Thank you for always being there and for caring!,"Date of experience: May 18, 2018"
www.dugood.org,Frances Thomas,1,US,They messed up my account I asked him…,They messed up my account I asked him not to pay someone they paid him anyway I only received 385 in that account and they let someone take almost $500 out of my account and I just think it's ridiculous now I'm in the negative account and can't do no one account that I really wanted not fair to me. I know nobody cares cuz I've been finding a long time so I just gave up that's why my account is in the negative how do you pay a bill that's more than the money that I received I don't even have those people service and then I told him that. They pay them anyway so that's why the count look like that and I don't care because I'm mad,"Date of experience: May 18, 2018"
www.dugood.org,August,5,US,Great customer service,,"Date of experience: May 18, 2018"
www.dugood.org,Taylar,5,US,I love duGood I sometimes have problems…,"I love duGood I sometimes have problems cashing certain checks and have been a member a very long time but, because of their great customer service and solution. I truly would recommend friends and family.","Date of experience: May 17, 2018"
www.dugood.org,Michael,4,US,I enjoy your staff and how they are…,"I enjoy your staff and how they are willing to help out. I also like the fact you send out updates on what is going on with DuGood. Thanks,Michael Steward","Date of experience: May 17, 2018"
www.dugood.org,Joy,3,US,Good experience drive thru,Good experience,"Date of experience: May 17, 2018"
www.dugood.org,Heather,5,US,I love DuGood!,I love DuGood!! The employees/staff are exceptionally friendly and knowledgeable!,"Date of experience: May 17, 2018"
www.dugood.org,Juanita,5,US,Always helpful and eager to answer any…,Always helpful and eager to answer any problems or address any other issues.,"Date of experience: May 17, 2018"
www.dugood.org,Jean,5,US,I had a problem with my debit card…,I had a problem with my debit card being breached and the lady that helped me went above and beyond her job to help me.,"Date of experience: May 17, 2018"
www.dugood.org,Patricia,5,US,DuGood is so easy to do business with…,"DuGood is so easy to do business with either online or in person.Everyone is friendly and helpful. I had a bit of learning to do and they have been helpful and patient. I love doing business online, it saves so much stress.","Date of experience: May 17, 2018"
