BankURL,UserName,ReviewRating,UserLocation,ReviewTitle,comments,ReviewDate
www.dugood.org,Carolyn,5,US,The refinance of my home was a very smooth process!,"The refinance of my home was a very smooth process.  I had dreaded getting started, but with the help of Sandra Flanigan and her Team, they made the process go very smooth from the beginning to the end, and I appreciate all of their help! Much appreciated!","Date of experience: August 06, 2021"
www.dugood.org,Joan Hadnot,5,US,Real good,Real good and okay,"Date of experience: August 05, 2021"
www.dugood.org,Mario Moreno,5,US,Auto Refinance,Audrey Hinson made my auto refinance easy as it could be she helped me through the whole process.,"Date of experience: August 04, 2021"
www.dugood.org,Nicole,5,US,Madison told Me that she was kinda…,Madison told Me that she was kinda new...but she gave Me a wonderful customer service experience & made Me happy that I chose DuGood!!!,"Date of experience: August 03, 2021"
www.dugood.org,Alyssa,5,US,Always friendly and very helpful,Always friendly and very helpful! Wouldn't want to bank anywhere else!,"Date of experience: August 03, 2021"
www.dugood.org,Shimi Mallick,4,IN,Best bank and nice employees,,"Date of experience: July 31, 2021"
www.dugood.org,Darrin Wayne ,5,US,Kind and Understanding,,"Date of experience: July 31, 2021"
www.dugood.org,Cynthia,5,US,Brenda was outstanding,"Brenda was outstanding, she worked really hard on our refinance, she went above and beyond helping us","Date of experience: July 31, 2021"
www.dugood.org,Jim,5,US,Purchasing our retirement home,DuGood helped us purchase our retirement home.  They were very helpful and kind.  Sandra and Rebecca were always available when we needed them.,"Date of experience: July 30, 2021"
www.dugood.org,Lynn Picard,5,US,I have banked with DUGOOD since 1992,"I have banked with DUGOOD since 1992.  I would not bank any other place.  They are always friendly, accommodating, and knowledgeable.","Date of experience: July 29, 2021"
www.dugood.org,Kesha,5,US,Best Loan Officer,Torey was my rep that helped me with my auto purchase. She was very polite and tentative throughout the entire process. She went above and beyond to ensure all my needs and concerns were addressed!,"Date of experience: July 29, 2021"
www.dugood.org,Sandra,5,US,Love doing business with Dugood,"Ms. Tara is so nice and helpful, we appreciate her.","Date of experience: July 28, 2021"
www.dugood.org,Amy,5,US,DuGood continues to exceed our…,"DuGood continues to exceed our expectations. Darlene was extremely efficient in helping my son obtain an auto loan.  This was his first experience in dealing with loans and buying a car from a dealer, but it was definitely a positive experience for him.  The dealer also commented on the fact that Darlene and DuGood FCU were the most helpful that he had seen.  He commented that it's usually hard to get the banker on the phone, but  Darlene was at our disposal and walked us through each step until the deal went through and all paperwork was completed.","Date of experience: July 28, 2021"
www.dugood.org,Augustus,4,US,Always great service and quick to help…,Always great service and quick to help when needed,"Date of experience: July 27, 2021"
www.dugood.org,Antionette,5,US,Friendly & Kind,They was kind and very helpful. Took care of everything I needed and more. Friendly i would recommend other's. Good to see smiling & friendly faces. 5 stars in my book.,"Date of experience: July 27, 2021"
www.dugood.org,Bailey,5,US,My experience with DuGood was…,My experience with DuGood was wonderful! They provided quick and friendly service and helped me with all of my questions.,"Date of experience: July 25, 2021"
www.dugood.org,VB,5,US,The young lady that helped me was very…,The young lady that helped me was very knowledgeable.  It didn't take long to take care of my business and I was on my way! Thanks �,"Date of experience: July 24, 2021"
www.dugood.org,Eleanor,5,US,Paula was amazing and answered all…,Paula was amazing and answered all question patiently and respectfully.,"Date of experience: July 24, 2021"
www.dugood.org,Gene,5,US,Personable and friendly,Everyone that works at the local Vidor residence is very personable and friendly.,"Date of experience: July 24, 2021"
www.dugood.org,Mary,5,US,We were greeted immediately upon…,We were greeted immediately upon arrival and were handled professionally.  Your new facility was very clean and organized.,"Date of experience: July 23, 2021"
www.dugood.org,Sara,5,US,Jennifer made the visit personal and…,Jennifer made the visit personal and pleasant! And sooooo easy!,"Date of experience: July 23, 2021"
www.dugood.org,Taylor,5,US,Easiest loan process I have ever went…,Easiest loan process I have ever went through!,"Date of experience: July 22, 2021"
www.dugood.org,Nancy,5,US,Great experience,Great experience.  Employees were very kind and helpful.,"Date of experience: July 22, 2021"
www.dugood.org,Terrence,5,US,DuGood personnel are the most courteous…,DuGood personnel are the most courteous and efficient people that has been my pleasure to be associated with. Thank you.,"Date of experience: July 20, 2021"
www.dugood.org,Gary,5,US,Brenda Frank helped me be able to…,Brenda Frank helped me be able to refinance my truck and also take care of the taxes for the truck that I bought out of state.,"Date of experience: July 19, 2021"
www.dugood.org,Keith,5,US,The process is very simple and all the…,The process is very simple and all the loan officers were very helpful and eager to satisfy me and get the job done,"Date of experience: July 19, 2021"
www.dugood.org,Linda m,5,US,Yes I give DuGood an excellent rating…,Yes I give DuGood an excellent rating because of their experience and being very professional and friendly and helpful and outstanding.Thank you for a great experience and taking care of our business needs.,"Date of experience: July 17, 2021"
www.dugood.org,Juanita,5,US,Very good customer service,,"Date of experience: July 16, 2021"
www.dugood.org,Jessica,5,US,Wonderful customer service and they…,Wonderful customer service and they take good care of their patrons! Highly recommended,"Date of experience: July 15, 2021"
www.dugood.org,Allison,5,US,Everything was super easy and fast,Everything was super easy and fast! Great customer service,"Date of experience: July 15, 2021"
www.dugood.org,Carla,5,US,Isaiah Peacock helped me with my Loan…,"Isaiah Peacock helped me with my Loan process to get a new Auto. Very efficient, quickly handled my request. Very pleased with his services and looking forward to continuing our Banking with DuGood. Thank you, Randal and Carla Janeaux","Date of experience: July 14, 2021"
www.dugood.org,Thomas,5,US,Super fast service and friendly as…,Super fast service and friendly as always.,"Date of experience: July 14, 2021"
www.dugood.org,William,5,US,Just a GREAT Experience,"Just a GREAT Experience, which it always is!!!Thanks for helping me save money,Miss Kristin Daniels made every step easy and was so helpful.I will continue be a member and also keep referring people to DuGood!","Date of experience: July 14, 2021"
www.dugood.org,Eric,5,US,Very fast and convenient loan process,Very fast and convenient loan process.  Thank you for your service.,"Date of experience: July 13, 2021"
www.dugood.org,Jennifer,5,US,The employees are professional,"The employees are professional, courteous and very helpful!","Date of experience: July 12, 2021"
www.dugood.org,Dondre Johnson,5,US,It was great and didn’t even have to…,It was great and didn’t even have to come off a lot of money to open account love dugood,"Date of experience: July 10, 2021"
www.dugood.org,Lori,5,US,Awesome service!,,"Date of experience: July 09, 2021"
www.dugood.org,Matthew,5,US,We refinanced our truck and had a great…,We refinanced our truck and had a great experience and Ronda was great getting everything done along with Rebecca,"Date of experience: July 09, 2021"
www.dugood.org,Brenda,5,US,Genise was my loan officer,"Genise was my loan officer, she was responsive, very accommodating and very thorough with the entire process.","Date of experience: July 09, 2021"
www.dugood.org,Sonia,5,US,Great Service!,Went and applied for a loan and everyone was very helpful and answered any and all questions I had! They made the process very easy to get through and helped me through it all!,"Date of experience: July 09, 2021"
www.dugood.org,William,5,US,Tara Baloney is the MOST out going person !,"Tara Baloney is the MOST out going , helpful , customer focused DuGood representative I have had the pleasure of working with in my 30 plus years of being a member . I originally joined as a Goodrich member in the early 80’s with a savings account and have worked with many people over the years , I by FAR am not the easiest person to work with and am very particular on everything I purchase . Tara has the patience to work with me where many would get aggravated ...... trust me ! It took me 8 months of looking at cars and her pulling numbers on over 40 for me , if that’s not patient I don’t know what is ...... to sum this up she is a valuable asset ( in my opinion ) and needs to be recognized ...... IF FOR NO OTHER REASON BUT PUTTING UPWITH ME!  This isn’t even to mention her having to take care of her others members / clients . Please let her know if I could give her a award for employee of the year , I would do it out of my own pocket . Sincerely John Buehrle","Date of experience: July 08, 2021"
www.dugood.org,Kimberly,5,US,Best bank I have ever had,The lender at the bank was very helpful she was very helpful she answered all my questions and returned all my calls and returned all my calls she was very nice,"Date of experience: July 08, 2021"
www.dugood.org,Kenneth,5,US,Best credit union by far!!!!!!!,Best credit union by far!!!!!!!! Ms Ronda does the best job to always help me!!!!!! Thankful to be a part of this credit union!!! Thanks for always helping me,"Date of experience: July 08, 2021"
www.dugood.org,Steven,5,US,Great place to get a loan.,The credit union was wonderful and quick to get my loan processed completely. The representative was friend and professional.The rate was also extremely low. I would recommend anyone that needs a loan use DuPont Credit Union.,"Date of experience: July 02, 2021"
www.dugood.org,Janet Parr,5,US,All of my experience with Dugood has…,"All of my experience with Dugood has been more than excellent.  Each time that I have had a transaction or needed help personnel at Dugood has always been there to assist in any way possible.  The Vidor bank is home for me but I have had the same excellent experience at the two branches in Beaumont. I really appreciate Dugood and there employees, especially Connie at Vidor office when I broke my shoulder and needed help with my banking. Would never bank anywhere else. Only Dugood.","Date of experience: July 02, 2021"
www.dugood.org,Derrick,5,US,Satisfied,"I was given all the information to do with my loan. This made me feel at home, my experience was excellent.","Date of experience: June 30, 2021"
www.dugood.org,Jack,5,US,DuGood Credit Union Review,"I told the hostess I came to open an account. She summoned Brenda who listened to my needs and then proceeded to go thru the process with me.Upon completion of the paperwork, my business completed, I departed.","Date of experience: June 30, 2021"
www.dugood.org,Diane,5,US,Good interest rate,Good interest rate. Recently refinanced our mortgage and DuGood made it very easy.,"Date of experience: June 29, 2021"
www.dugood.org,Keith Duncan,5,US,Excellent Service,I recently opened two accounts at the Orange TX. Branch. CUSTOMER Service was fast and friendly. I felt right at home from the moment I entered. Amy and her trainer worked quickly to address my needs and I was very pleased with the quality of service I was given. It was my assumption that Amy was new. However that didn't stop her from assisting my needs with excellence.  Thanks to Amy and the team training her.,"Date of experience: June 29, 2021"
www.dugood.org,Cindy,5,US,Nice to a costumer.,,"Date of experience: June 27, 2021"
www.dugood.org,Jenike,5,US,They lady was very nice she talked…,They lady was very nice she talked everything down with me she also gave me a lot of options.,"Date of experience: June 26, 2021"
www.dugood.org,Joshua,5,US,Awesome service and very quick,,"Date of experience: June 26, 2021"
www.dugood.org,Amanda,5,US,Very easy to open a checking account…,Very easy to open a checking account and saving through y'all. Staff was very helpful and nice!,"Date of experience: June 25, 2021"
www.dugood.org,FRED Dyson,5,US,Maggie was very helpful and friendly,,"Date of experience: June 25, 2021"
www.dugood.org,Peddys,5,US,Awesome experience,"I applied for our loan online late at night and got a call from Kennedie FIRST thing the next morning. She handled it promptly, professionally and kept me updated regularly throughout the process. It was literally quick and painless!","Date of experience: June 25, 2021"
www.dugood.org,Charles,5,US,Sandy Ferrell was amazing,"Sandy Ferrell was amazing, incredibly informative and helpful. Highly recommend DuGood for any loan needs.","Date of experience: June 25, 2021"
www.dugood.org,Becky,5,US,Friendly staff,Friendly staff. Quick set up.,"Date of experience: June 25, 2021"
www.dugood.org,Kaleb,5,US,I love DuGood!,Megan is wonderful! She is always so friendly and helpful every time I call her. Everyone at DuGood is! I’ve been a member for 10 years now and I don’t want plan on going anywhere anytime soon.,"Date of experience: June 25, 2021"
www.dugood.org,Jesse,5,US,Loan department was fast  and  knew…,Loan department was fast  and  knew what they were doing,"Date of experience: June 21, 2021"
www.dugood.org,Richard,5,US,Very quick,"Very quick, easy and very professional!","Date of experience: June 21, 2021"
www.dugood.org,Robert,5,US,Megan did a debt consolidation loan for…,Megan did a debt consolidation loan for me. She was excellent & fixed everything I asked for!,"Date of experience: June 20, 2021"
www.dugood.org,Melvin,5,US,You are the best,You are the best. I had been with another bank for 12 years and my S S check and my V A check had been deposited into that bank and at one time I had 5300 in my checking and they would not loan me  3500 for a bass boat. As soon as I can I will have everything transferred over to my new bank. Thanks  Melvin Douglas McElroy Sr.,"Date of experience: June 20, 2021"
www.dugood.org,Kirt,5,US,Y'all do a great job as usual,,"Date of experience: June 19, 2021"
www.dugood.org,Louis,5,US,Sandi at Dugood in Jasper was awesome,,"Date of experience: June 18, 2021"
www.dugood.org,Stephen,5,US,Dugood Federal Credit Union is my only…,Dugood Federal Credit Union is my only banking source. They are always there for their customers. They have given me a hand up when I needed it and didn't have anyplace to go. I can't  thank them enough.,"Date of experience: June 18, 2021"
www.dugood.org,Reginald,5,US,The Credit Union met all my needs,The Credit Union met all my needs. Tara made my car buying experience very easy. She is very knowledgeable about lending and banking business. Thank you very much.,"Date of experience: June 17, 2021"
www.dugood.org,James Miller,5,US,I needed a loan reworked so I called…,I needed a loan reworked so I called dupont and talked with Torey and she helped me go thru it all over the phone and I did'nt have to miss any work so I could'nt be any happier but whats new Dupont has always been there to help me out when needed.,"Date of experience: June 16, 2021"
www.dugood.org,Carl,5,US,DuGood is the best That I have ever worked with for loans and banking needs.,The entire transaction was very nice. Brenda has always done a great job working with me for my loans over the past 20 years. She has always gone above and beyond to take care of my needs. Thank you,"Date of experience: June 16, 2021"
www.dugood.org,Tom,5,US,Dugood Exceeded my expectations,"The team exceeded all expectations on my personal vacation loan, new accounts and even offered to assist in other financial opportunities as well.   Everyone was professional and responded timely.  There were only 5 stars above but I would have chosen 6 if available.","Date of experience: June 16, 2021"
www.dugood.org,Roger,5,US,Sandy was very helpful and processed my…,Sandy was very helpful and processed my loan fast.,"Date of experience: June 16, 2021"
www.dugood.org,Kirk,5,US,Excellent Loan Support,The loan process was quick and easy.  The last few loans I’ve taken from DuGood have been the best rates around also.  Great job DuGood!,"Date of experience: June 16, 2021"
www.dugood.org,Tammy,5,US,Best credit union ever,"Best credit union ever , great customer service very promp and helpful","Date of experience: June 15, 2021"
www.dugood.org,Dona,5,US,Very impressed,I felt like everyone I dealt with was professional and kind as well worked efficiently. Thank you!,"Date of experience: June 15, 2021"
www.dugood.org,Susan,5,US,Loan Officer Brenda Franks is…,Loan Officer Brenda Franks is phenomenal with her customer service skills . She was extremely patient and helpful with the process . She took time to explain each and every aspect of the loan . She kept me updated every step of the way . She even stayed late one evening after coming back from vacation to work on loans for her customers . Dugood this woman is by far one of your biggest assets . I admire and appreciate her passion for customer service . She is a busy lady and yet always makes you feel like you are her number one priority . Thank you Ms Brenda .,"Date of experience: June 10, 2021"
www.dugood.org,Penny,5,US,We applied for a vehicle loan and…,We applied for a vehicle loan and received a response that afternoon.  The loan officer was very prompt and friendly during the process. The loan was completed in two days. The process was very expedite with exceptional communication which made the experience very satisfying,"Date of experience: June 08, 2021"
www.dugood.org,Anastasia Fontenot-Cormier,5,US,All who touched the process were…,All who touched the process were courteous and professional.   Tara went the extra mile to make sure I was taken care of and my time was not wasted.  I appreciate all they did!!,"Date of experience: June 08, 2021"
www.dugood.org,Culley,5,US,My experience with the purchase of my…,My experience with the purchase of my last vehicle went great. All of my purchases have went seem less. Thank you DGFCU,"Date of experience: June 06, 2021"
www.dugood.org,Bertha,5,US,Great service!,"The friendly and professional staff at Dugood made the process of our home equity loan so easy. Sandy Ferrell was our loan officer and she was so helpful and very responsive to all our questions. Great experience, highly recommend!","Date of experience: June 06, 2021"
www.dugood.org,Kennie,5,US,Applying for loan,Torey was very professional and courteous and was able to take care of all my needs. She was able to answers all my questions and to make changes if needed. Hats � off to Torey I would refer her to friends and family.,"Date of experience: June 05, 2021"
www.dugood.org,Jace,5,US,DuGood made the car financing…,DuGood made the car financing experience so easy! When going to the dealership I already had a price and I didn’t need to go back and forth. Katrina from the Jasper store was so helpful and knowledgeable! I highly recommended financing through DuGood for your next car.,"Date of experience: June 04, 2021"
www.dugood.org,James,5,US,When you walk into Dugood everyone…,When you walk into Dugood everyone greets you and ask if you need help. Very informative.,"Date of experience: June 03, 2021"
www.dugood.org,Henry Hebert,5,US,Best Mortgage Loan Officer,"Sandra Flanigan is great to work with, she goes above and beyond to help you in all your needs. Thanks for all your help","Date of experience: June 02, 2021"
www.dugood.org,Kena,5,US,This was my first time to refinance a…,This was my first time to refinance a vehicle.  The associate at DuGood patiently walked me through each step and answered every question I had.  I felt comfortable with her and would definitely use DuGood again for banking needs.,"Date of experience: June 02, 2021"
www.dugood.org,Connie,5,US,very nice employees,,"Date of experience: June 01, 2021"
www.dugood.org,Allen,5,US,It was a big help to us and didn't take…,It was a big help to us and didn't take long to get the lone,"Date of experience: May 31, 2021"
www.dugood.org,Collin,5,US,I would like to know if you offer an…,I would like to know if you offer an app so I can pay with an app.  The girl that called me wasn’t sure if you had one or not.,"Date of experience: May 31, 2021"
www.dugood.org,Ephram,5,US,Great service!!!,,"Date of experience: May 30, 2021"
www.dugood.org,Ronnie,5,US,Very professional straightforward and…,Very professional straightforward and efficient service.,"Date of experience: May 28, 2021"
www.dugood.org,Barbara,5,US,Yes I Enjoy Doing Business With Y'all I…,Yes I Enjoy Doing Business With Y'all I Ask Questions Y'all Gave Me The Answer,"Date of experience: May 28, 2021"
www.dugood.org,Gary,5,US,So far this has been a great bank for…,So far this has been a great bank for me . They didn’t know me from Adam and refinanced my truck and gave me a loan . My credit is not the best but the du good bank came thru for me .. ty gt,"Date of experience: May 28, 2021"
www.dugood.org,Nicole,5,US,It is with much enthusiasm that I…,"It is with much enthusiasm that I recommend Tara Baloney for your loan officer!  She is knowledgeable, fast and accurate. She will answer any questions or concerns that you may have during the process. She is not one of those loan officer who is there just to make money but also to guide you in the right direction and meet our needs.","Date of experience: May 28, 2021"
www.dugood.org,Dayne,5,US,Very easy to work with,Very easy to work with. Great hospitality and friendly staff. Did it all on my phone. Got the money I needed within 3 hours,"Date of experience: May 26, 2021"
www.dugood.org,Roy,5,US,Great service,,"Date of experience: May 26, 2021"
www.dugood.org,Tiffany M.,5,US,DuGood Kuddos,"I’ve cultivated a relationship with DuGood Credit Union after approval of my vehicle from Classic of Beaumont for over 3 years. Anything I’ve needed assistance with since then, their response has always been a very prompt and professional yes.","Date of experience: May 26, 2021"
www.dugood.org,Freddy G Richardson,5,US,Being a member for over 30 year,"Being a member for over 30 year, I have never had an unfriendly encounter with my friends at DuGood Federal Credit Union.  Apparently, some credit unions are not near as friendly.  When I went to pick up my car in Dallas yesterday, the car salesman mentioned that my credit union was different from others he had encountered.  They spoke to him respectfully, and he enjoyed the experience.  As always, my financial transaction are handled expediently, and without hassle.  If you haven't experienced the DuGood way, you're missing the best way.","Date of experience: May 25, 2021"
www.dugood.org,Dylan,5,US,Great customer service,,"Date of experience: May 25, 2021"
www.dugood.org,Lisa,5,US,Mortgage Loan,"Sandy Ferrell, Mortgage Loan officer, recently went above and beyond to help get our new house mortgage loan & closing on it. She answered every question we had & gave us all the information we needed for different scenarios concerning this loan.  She is extremely knowledgeable, prompt, professional & friendly & worked after hours to get this done.  She has handled our past mortgages as well.  I can't say enough good things about any of our experiences.I have done business with Dupont/DuGood for many many years & have always had exceptional customer service in ay area.","Date of experience: May 24, 2021"
www.dugood.org,Ernesto,5,US,Very professional.And fast service,,"Date of experience: May 23, 2021"
www.dugood.org,Kathy,5,US,They are always there to help,They are always there to help.  Very friendly and courteous.,"Date of experience: May 20, 2021"
www.dugood.org,Joshuah,5,US,I love banking with DuGood,"I love banking with DuGood, the staff is amazing and they’re always there when I need them !","Date of experience: May 18, 2021"
www.dugood.org,Cindy,5,US,"Great rates, Great people, and local",They have always treated me well and provided me with any financing that I've ask for. Their rates are great too.,"Date of experience: May 17, 2021"
www.dugood.org,Michael,5,US,Monica James had everything ready to go…,Monica James had everything ready to go upon my arrival and made it an easy process.,"Date of experience: May 17, 2021"
www.dugood.org,Marilyn,5,US,Five Stars For Sure!,We’ve been very pleased with every interaction we’ve had with DuGood. The staff is efficient and courteous. We look forward to doing business with this bank.,"Date of experience: May 17, 2021"
www.dugood.org,James,5,US,Everything went very smoothly Tara did…,Everything went very smoothly Tara did a excellent job from start to finish on my share loan for my son,"Date of experience: May 14, 2021"
www.dugood.org,Jerald,5,US,My refinance team did a great job…,"My refinance team did a great job helping me get a home equity loan.They were informative and kept me updated step by step on where we were, they also explained each move, I could’ve had a better experience and a stress free situation.THANKS to the whole credit union and SPECIAL THANKS to my team.  Again THANKS! Jerald King �","Date of experience: May 14, 2021"
