BankURL,UserName,ReviewRating,UserLocation,ReviewTitle,comments,ReviewDate
www.dugood.org,Belinda Lane,5,US,I truly enjoyed Ms,"I truly enjoyed Ms. Jennifer at the Jasper branch. She is a special lady. Nice, kind, personable and she is very knowledgeable. She explained the different accounts to me and helped me pick out my debit card.  I enjoyed Ms.Jennifer and I look forward to doing business with DuGood.- Belinda Lane","Date of experience: December 28, 2022"
www.dugood.org,Chukky,5,NG,Nice service and I can testify they…,Nice service and I can testify they have one of the best staffs ever.and also they are one of the most reliable online banks,"Date of experience: December 27, 2022"
www.dugood.org,Debra,5,US,Wonderful staff & prompt     The staff there are always helpful and…,The staff there are always helpful and willing to help.  They are professional and prompt on decisions,"Date of experience: December 30, 2022"
www.dugood.org,Kemar Adams,5,GB,Great bank,"Great bank, very good customer service. In and out, very efficient.","Date of experience: January 02, 2023"
www.dugood.org,Toni,5,US,The Nederland branch is the best,The Nederland branch is the best. I am always treated like I am the most important person there. I always come out with a smile. The employees always are professional and have your best interest in mind.,"Date of experience: December 20, 2022"
www.dugood.org,Alfred,5,US,What made my experience so wonderful…,"What made my experience so wonderful was the relief that came when I was approved for this loan, it is a feeling of freedom and peace, to have that opportunity offered and then it became a reality is a wonderful reminder that there are people who care. The sweet lady who filled out my loan application was very professional and courteous  at the same time very kind and helpful...I thank her for representing your company so well and overall, I express my sincere gratitude to you,  this company for reaching out and helping me through this special time of the year,  Thank you so very much,  wish you all a very warm and fond holidays,  Merry Christmas and thank you so very much again, sincerely,  Alfred Jessop.","Date of experience: December 19, 2022"
www.dugood.org,Jannia,5,US,I was able to fill out an application…,I was able to fill out an application for a loan on Saturday and had a reply by Monday. All paperwork was completed in my preferred location. Everyone was pleasant and friendly.,"Date of experience: December 19, 2022"
www.dugood.org,Doris,5,US,"People are important, people matter.","My experience was great. The agent listened to my needs - was very knowledgeable, courteous, friendly and respectful. She resolved my issue with professionalism.","Date of experience: December 20, 2022"
www.dugood.org,LINDA JONES,5,US,The Jones Family,Ms. Daniels was very professional. Excellent customer service. She made me feel important and like a family member of DuGood FCU instead of a member. I have never taken out a loan before. I'm grateful for her assistance in helping me.,"Date of experience: December 08, 2022"
www.dugood.org,James,5,US,Great staff quick and easy opening an…,Great staff quick and easy opening an account,"Date of experience: December 29, 2022"
www.dugood.org,DIOCSEO,4,VE,A GREAT COMPANY VERY HONEST…,A GREAT COMPANY VERY HONEST ANDRESPONSIBLE WIHT ITS CUSTOMERS,"Date of experience: October 11, 2022"
www.dugood.org,Lasundra,5,US,I didn’t have to wait long before some…,I didn’t have to wait long before some waited on me. The paperwork was there and ready for me to sign. The employee was easy to talk to and knew exactly what she was doing. Friendly and to the point.,"Date of experience: December 12, 2022"
www.dugood.org,Christopher,3,US,I am very pleased with the timeliness…,I am very pleased with the timeliness in which I had received a response but could've used a little more direction as to what steps need to be taken to fix credit errors so that I may be able to get a loan,"Date of experience: December 09, 2022"
www.dugood.org,Latoya Young,5,US,Loan department,"The loan representative, Tara Baloney, always makes borrowing a smooth process. She gets note than 5 stars from me. She poise friendly and prompt customer service. I recommend everyone to the institution for all their financial needs. They offer excellent rates and approval odds.","Date of experience: December 06, 2022"
www.dugood.org,MyKeesha,5,US,Smooth transaction and Exceptional Customer Service!,"Truly a great experience to inquire about a loan, then apply, and got approved all with in less than 15 minutes! Ms. Kristin Daniels was AMAZINGLY AWESOMESAUCE! She was very fast and knowledgeable~ answered every concern I had and made me feel at ease and peace with running my Credit, understanding that I can't afford a hard hit for nothing . I really love DuGood Federal Credit Union and I most definitely will refer! As a matter of fact, I brought in a New Customer last month!","Date of experience: December 01, 2022"
www.dugood.org,James,5,US,Audrey was very sweet and easy to work…,Audrey was very sweet and easy to work with. She got all the information I need to make this experience as easy as possible,"Date of experience: December 20, 2022"
www.dugood.org,Phyllis,5,US,Fast easy the work with and very responsive..thanjs,Fast response to a loan very friendly and helpful and fast releasing funds,"Date of experience: December 27, 2022"
www.dugood.org,Lora,5,US,She was very knowledgesinallable in all we needed,She was very knowledgeable. Very interested in me and my daughter,"Date of experience: December 27, 2022"
www.dugood.org,Lawrence Barrios,5,US,Its about TRUST!,"I diid not receive all hat I wanted  i did however get enough help to lessen my problem,and I understand why it was done this way. I have been wjth this credit union many years and the people there have  always been as curteous and friendly and make you feel that everything is buisness like and secure.","Date of experience: November 22, 2022"
www.dugood.org,Ebony,5,US,Overall the experience was very…,Overall the experience was very enjoyable and I am pleased with the customer service I received. I took a loan on a very short notice and had the funds available literally the same day. The process was smooth and hassle free and I would recommend anyone to contact DuGood for holiday or personal loans.,"Date of experience: November 25, 2022"
www.dugood.org,Welton,4,US,Professional …,"The experience of the loan officer and the ease of filling out the paperwork. I didn’t really want to get a loan , but events and conditions made it a necessity.","Date of experience: December 07, 2022"
www.dugood.org,Michael R Tarver,5,US,"Friendly staff and knowledgeble,and straight forward!","Very knowledgeable, knowing just I need,and confirm what I needed first and how to go about it, thanks and I would recommend DuGood bank to my friend's.","Date of experience: December 09, 2022"
www.dugood.org,Asim Nawaz,5,IN,Excellent bank which provide loan…,Excellent bank which provide loan easily and at low interest,"Date of experience: April 01, 2022"
www.dugood.org,Thomas,5,US,Service,How fast it was to sign up,"Date of experience: January 02, 2023"
www.dugood.org,Ronald DuBose,5,US,It’s always hassle free and a pleasure…,It’s always hassle free and a pleasure dealing with Tara Baloney. She takes care of her business in a very professional and timely manner!,"Date of experience: December 12, 2022"
www.dugood.org,John,5,US,Getting the loan was quick and easy !,Getting the loan was quick and extremely easy. Rhonda Hamilton is awesome to work with !,"Date of experience: December 21, 2022"
www.dugood.org,Delma,5,US,Alwalys great and easy to get my loan,Always great and easy to get my loan. Kristen is awesome. Dugood is my favorite place. Happy holidays to everyone!,"Date of experience: December 12, 2022"
www.dugood.org,Lonnie D. Whiteside,5,US,Honesty.,"Very friendly , welcome atmusefear & all the employees made you fill at home.","Date of experience: December 21, 2022"
www.dugood.org,Vicky Guillory,5,US,What made it great was she was fast and…yes she was very fast,What made it great was she was fast and I really didn't have a bunch of paperwork to do..she was very friendly.,"Date of experience: December 07, 2022"
www.dugood.org,Jodee,5,US,Applying for a loan,"I applied for a loan over the phone and the process was  convenient, quick and stress free. Cara was exceptionally friendly, courteous, and helpful.","Date of experience: December 07, 2022"
www.dugood.org,Ben Grender,5,GB,Works as it should,Works as it should. No complaints :),"Date of experience: December 30, 2022"
www.dugood.org,Troy Trahan,5,US,Great customer service at DuGood!,"Customer service is awesome!    Very easy to speak to a loan officer, get the information needed and make a purchase.  This is important to me in today’s market, because timing is critical to make a deal.  My loan officer (Kristin Daniels) was very helpful and dealt with me via text, which was easy for me as I am in and out of my office.  We were able to get all the information needed to get the loan approved and funded the same day.  Even though the seller is not located in town, they were able to visit a Dugood branch in their area to drop off the title and pick up their check, again making it easy to transfer the title and complete the transaction.  I was able to visit my local branch and complete my portion of the paperwork even though my loan officer was located in another branch.  I have been with Dugood for many years and will continue to partner with them for many more.  Feels like family, especially when dealing with Rhonda at my local branch.","Date of experience: December 05, 2022"
www.dugood.org,Tanisha,5,US,Loan officer Tori Johnson was great!,"Loan officer Tori Johnson was great!! She helped look at the best option for me and my financial needs. She was very patient going through all my options and most of she was genuinely patient. Great job DuGood choosing the most professional, knowledgeable and pleasant staff.","Date of experience: November 02, 2022"
www.dugood.org,Shawn,5,US,Always friendly and great customer…,Always friendly and great customer support!,"Date of experience: December 26, 2022"
www.dugood.org,Customer,5,US,Easy money! Best loan process.,I've used this bank app and the loan process a couple of different times and it's always been very quick and easy. The personal are wonderful and good at returning phone calls because of them I have the money for my new air-conditioning.,"Date of experience: November 09, 2022"
www.dugood.org,Chandra,5,US,DuGood is Always Welcoming!,"DuGood is always welcoming. DuGood has made doing business efficient, and easy to access which means information can be expeditiously processed. Using the DuGood App is what I love. Everything at your fingertips, at a glimpse. If you are thinking of doing financial business anytime of the day, you can achieve it via the DuGood App or website. It is easy to access no matter what your needs are. Questions are quickly answered with a real person to provide support.","Date of experience: October 17, 2022"
www.dugood.org,Michael,3,US,Communication,"I really like and appreciate the folks at the Mont Belvieu office, they always go above and beyond. The experience with my loan officer, not so much. She failed to call me, answer my calls or even text me on the day I was to pick up my new vehicle to inform me that I had to drive to Mont Belvieu to sign docs and pick up the check. So it was very inconvenient for me and took hours to resolve. When I mentioned that she left me hanging out there, she didn't seem too concerned she was ""at lunch"". I will go directly to the Mont Belvieu office from now on.","Date of experience: October 28, 2022"
www.dugood.org,Jay Rich,5,US,The online experience was great,The online experience was great. It was easy to go through and shortly thereafter a representative from the branch called me to confirm my information and that it was I that set up the account and she was super knowledgeable. Thanks DuGood for the most perfect opportunity to bank with you.,"Date of experience: October 26, 2022"
www.dugood.org,Lora Hebert,5,US,It's always a pleasure working with…,"It's always a pleasure working with Brenda, at the Port Neches Branch. She always takes the time to meet ours needs.  we tell all our friends to use Dugood.","Date of experience: November 23, 2022"
www.dugood.org,Kristin,5,US,Super simple!,Everything was made super easy and we got what we needed done super fast,"Date of experience: December 20, 2022"
www.dugood.org,Gerald,5,US,I work out of town and the Ladies at…,I work out of town and the Ladies at Jasper make it easy for me to purchase things . They are the greatest . Appreciate them very much .,"Date of experience: November 29, 2022"
www.dugood.org,Allen & Vanna Downey,5,US,Mrs Allen Downey,Ms. D. Cudd at our Branch Office in Lumberton was very informative and helpfull.  She explained everything in a way we could understand and assisted us in correcting the problem.,"Date of experience: November 14, 2022"
www.dugood.org,Phillip,5,US,They were very helpful kind and made it…,They were very helpful kind and made it very easy to get the loan I needed to help my credit,"Date of experience: December 12, 2022"
www.dugood.org,Kaden,5,US,she was very fast,"she was very fast. nice, and to the point, couldn’t have gone better","Date of experience: December 19, 2022"
www.dugood.org,Glenda,5,US,DuGood is Great Place to handle your money needs,Wanted a local  credit union that could meet our needs. DuGood met and exceeded all other local CU's and the employees at the Jasper branch were great to work with. Would recommend them to all of our family and friends.,"Date of experience: November 03, 2022"
www.dugood.org,Jennifer Fisher,5,US,Super fast and easy loan process,Loan process was super fast and easy. I applied and had the money within the same day. DuGood staff was very helpful and worked efficiently.,"Date of experience: November 28, 2022"
www.dugood.org,Brenda,5,US,A little scary at first,A little scary at first But Pauline Villarreal and Christine  took all the fear away and I say thank You,"Date of experience: November 14, 2022"
www.dugood.org,Roberto Sime,5,US,Gc b x in j jyxxiif,,"Date of experience: December 31, 2022"
www.dugood.org,Kathleen,4,US,The only complaint I have is the choice…,"The only complaint I have is the choice of music playing overhead. I believe it was Christian rock/pop. I don't understand why something so personal such as religious belief was necessary for my experience. It had me wondering if the company was limited in its inclusion based on religion or possibly even other factors.Otherwise, my experience was great.","Date of experience: September 20, 2022"
www.dugood.org,Chanell Milian,5,US,Great service and friendly atmosphere. The employees were great in helping me get my accounts set up.,Great service. The employees were very friendly and helpful. They were helpful in getting my accounts set up and my debit card activated. I'm looking forward to a great experience with your company.,"Date of experience: November 04, 2022"
www.dugood.org,Lindsay,5,US,Great service and awesome benefits.,The benefits they provide are awesome and it was so easy to open an account. I am very pleased with the service they provide.,"Date of experience: December 02, 2022"
www.dugood.org,Katie,5,US,Exceptional Customer Service,Dealing with the personnel at the Jasper location for business with my new job has been so exceptional that I decided to open a personal account there. I recently moved from the Dallas/Fort Worth area and had a bad experience with Wells Fargo and fraud on my account. I look forward to doing business with a financial institution who truly care about their customers. Thank you!!,"Date of experience: September 07, 2022"
www.dugood.org,Derrick,5,US,Loan was a VERY smooth process,"Loan was a VERY smooth process. The dealership even commented how smooth the process was. Interest rates were best available. Great communication between all 3 (dealership, myself, and DuGood..Ready to bring all finances to DuGood.","Date of experience: October 17, 2022"
www.dugood.org,Kristin,5,US,Flexibility to help a customer bring in…,Flexibility to help a customer bring in new money. Kim D. and Beth L. were very customer service friendly.,"Date of experience: December 06, 2022"
www.dugood.org,Brandon,5,US,Loan application and process,When applying for a loan online the process was fast and simple. I call to ask about it and someone was able to give me information and help me understand the approval odds. They got back to me within a couple of hours and the money was in my account.,"Date of experience: October 06, 2022"
www.dugood.org,Melba,5,US,Fast and Easy Approvals,"How fast that had me approved for my Christmas Loan, I applied that morning and by the evening the money was in my account. It was all hassle free.","Date of experience: November 21, 2022"
www.dugood.org,Rashica,5,US,Great customer service they were polite…,Great customer service they were polite and friendly. Some one helped me right away,"Date of experience: December 14, 2022"
www.dugood.org,Leslie,5,US,A new A/C for me !,"I have been in need of a small auxiliary air conditioning unit for my bedroom. I decided to apply for the funds thru DoGood's banking app. Service was quite prompt, as well as easy-to-use,  the whole process took less than 4 hours and received the funds in my account shortly after lunch the same day. I am most pleased with the all the services I recieved.","Date of experience: August 26, 2022"
www.dugood.org,Razaur Rahman,5,BD,fine,Awsome services,"Date of experience: December 31, 2022"
www.dugood.org,DIANA YOUNG,5,US,The Loan process was so easy  from…,The Loan process was so easy  from being to end. And not having to go into the Branch too finalize the paperwork was great.,"Date of experience: November 28, 2022"
www.dugood.org,Darlene,5,US,I walked to the office to the smiling…,I walked to the office to the smiling face of Carrie . She took me into her office and opened my account. She is very personable and so nice to work with.,"Date of experience: November 15, 2022"
www.dugood.org,Debra,5,US,Personal Loan,"I went in to the Lumberton Branch to apply for a loan, a first for me.Darlene Ford is the lady that helped me. She made the whole process so easy for me and I left feeling on top of the world. Thank you Dugood for hiring such wonderful employees.","Date of experience: September 26, 2022"
www.dugood.org,Carol,5,US,Darlene has been great to work with,Darlene has been great to work with! She went above and beyond to help me set up a savings account and a CD! I am thrilled with my experience at DuGood and am already referring others to Darlene!,"Date of experience: October 24, 2022"
www.dugood.org,Linda,3,US,I just completed my second loan with…,I just completed my second loan with DuGood working with Kristin Daniels. Again she handled it with efficiency and completed it in a very timely manner. Kristin always makes the process as easy and convenient for you as possible. I highly recommend DuGood and Kristin.,"Date of experience: September 14, 2022"
www.dugood.org,Howard,5,US,Needed a new vehicle loan,"Needed a new vehicle loan. Got the pre-approval, ordered the vehicle and when the dealership called, DuGood was there to get everything completed flawlessly. Thank you Carrie, Jo and Brenda!  I’m a customer for life!","Date of experience: October 11, 2022"
www.dugood.org,Karen Williams,5,US,I’m truly happy to be a member of…Happy member,I’m truly happy to be a member of DuGood Credit Union. They have help me in most difficult times when I need it I will never go to any other credit union or bank . I’m very grateful to be a member there at each branch everyone has been so courteous!! All � stars to them,"Date of experience: September 07, 2022"
www.dugood.org,Harold,5,US,Great Customer Service,"I have been a member with DuGood for about 5 years, anytime I have had an issue they were fast to help and anytime I have needed a lone the prosses was painless.","Date of experience: November 07, 2022"
www.dugood.org,Warren,5,US,I recently found myself in Tennessee…,I recently found myself in Tennessee and had a need for several thousands of dollars in a hurry and called DuGood FCU and talked with Stephanie who said no problem. She asked me where I was in Tennessee and then put me on hold for a minute and came back and told me where a sister FCU in this area was and how to ask for a Bank transfer. I went there and my problem was solved. Had I been with a bank they would not have had a sister bank that would have been able to save the day. I have been a member of DuGood for ten years now and it's the only way to bank! Warren,"Date of experience: August 20, 2022"
www.dugood.org,Ceddric,5,US,They were very very very excited to see…,"They were very very very excited to see me in the branch and got me off Xpress loan, and everybody greeted me saying how I was in and out would definitely go back to that branch","Date of experience: October 26, 2022"
www.dugood.org,Jennifer,5,US,Dugood is the Best,"Dugood is always wonderful to work with. I had a great experience with Kristin in the Orange, Texas office this week. She was kind, helpful and very knowledgeable. I live hours away from the closest Dugood Federal Credit Union, but I’ll never bank anywhere else.","Date of experience: August 27, 2022"
www.dugood.org,Danny Thomas,5,US,"DuGood, good loan experience!",I believe that Kristen Daniels in loans is one of the best that I have done business with in years. Makes me want to do all my business with DuGood and quit shopping around. She even caught the VIN incorrectly recorded by the seller. Thanks,"Date of experience: September 07, 2022"
www.dugood.org,nwash,5,US,I've been a DuGood FCU member for many…,"I've been a DuGood FCU member for many years. Torey has been one of the most exceptional loan officer in my history of banking with the credit union. Always responsive, prompt, knowledgeable and highly efficient. Thank you again Torey! Much appreciated!","Date of experience: August 27, 2022"
www.dugood.org,Jeffery,5,US,Loan,My experience was great. Wasn't approved for I wanted. I did total underistand. I did get a loan and was happy with it. The staff is always helpful and nice. Been doing business with them a long time. Will for many years to come.,"Date of experience: September 15, 2022"
www.dugood.org,Patricia,5,US,Greetings,Always greeted when I walk in. I visit probably once a week. Well known. Recently got a personal loan. Very informative and knowledgeable about the product. Very patient and made sure I understood everything regarding the loan.,"Date of experience: August 26, 2022"
www.dugood.org,Tim M,5,US,I applied for a small loan to do some…,"I applied for a small loan to do some home renovations. I was contacted promptly and signed the papers for the loan the same day . Been with DuGood for many years, they have always taken care of me and my needs.","Date of experience: September 27, 2022"
www.dugood.org,Franklin,5,US,Tammy  Simmons,I was very pleased with the service that Tammy gave me and has always giving me with any and all questions and transactions that we have done over the years. And I look forward to dealing with her again in the future thank you very much Frank Estes,"Date of experience: August 23, 2022"
www.dugood.org,Annette,5,US,Mortgage loan,"Sandra and Pauline made the mortgage process a breeze! They answered every question, and put my mind at ease through the whole process. I would definitely choose to go through it again with them!","Date of experience: October 06, 2022"
www.dugood.org,Aaron,5,US,Everything was great,Everything was great! They went above and beyond to help get everything done I needed. Will continue doing business with them,"Date of experience: November 16, 2022"
www.dugood.org,Chima,5,US,very reliable,very reliable. communication . good customer service,"Date of experience: December 19, 2022"
www.dugood.org,Dylan,4,US,Quick service and a big help,Quick service and a big help.  Responded to my inquires quickly with candor and professionalism.  Wait time on call queue is a bit long when dialing the main line but direct lines to employees (if you know their ext) is always fast.,"Date of experience: September 01, 2022"
www.dugood.org,Amy,5,US,Thank you for always being kind and…,Thank you for always being kind and friendly.  I applied for a loan and within the same day I had an answer.  You do not know how much this means to me.  Thank you so much for everything.,"Date of experience: October 03, 2022"
www.dugood.org,Larry,5,US,Prompt service,Prompt service . Thank you for your assistance.,"Date of experience: December 14, 2022"
www.dugood.org,Jordan,5,US,The best credit union experience,I was in need to open a bank account and every other bank had told me no but as soon as I came into DuGood i was helped and was able to walk away with a bank account.,"Date of experience: October 12, 2022"
www.dugood.org,Regina,5,US,Courtesy & Respect,"Very prompt, courteous, professional staff! Always willing to try & help their customers!","Date of experience: November 30, 2022"
www.dugood.org,Odis,5,US,I showed up late in the day to start a…,I showed up late in the day to start a new account. The lady was very helpful and respectful and walked me through everything to understand how it all works and made the process simple,"Date of experience: September 21, 2022"
