comments,about,topic
Amazon Basics Earbuds arrived in an excellent and typical Amazon Basics Box and it contained the Matte Charging Case along with the EarBuds which is partly Matte and partly Glossy along with a USB Type C cable and few spare ear tips The build quality is amazing as usual and feels sturdy even though I m not a huge fan of matte designed products The most important thing to note is this Earbuds are so big and bulky which might not fit into someone who are having small or medium ears I suppose Although it was light weight I felt little uncomfortable while the pTron Earbuds were of a perfect fit to my ears which was neither bulky nor long and bigger when compared this one But having changed the ear tips to smaller one provided it felt better but it was still uncomfortable due to its bulky size Features There is a lot of touch controls available to for increasing and decreasing the volume playing the next track pause and play etc But it doesn t work flawlessly It was always a hit and miss kind in my Samsung Smartphone which was little annoying at the beginning But as I was using it more often it felt ok eventhough there was a little delay in response which we will get used to while using it on a daily basis I liked the sound effect they used to indicate the Earbuds establishing the Bluetooth connectivity and also when it gets disconnected It was so pleasant for me I never liked the usual connected and disconnected voice messages This is one feature I really like in this Amazon Basics Earbuds Performance The most disappointing thing about this Earbuds is it s performance First I tried using it to listen to the Podcast which gave me a pleasant experience in terms of sound quality and I was happy But each time I try to pause a podcast episode by using long press it played the next episode instead of pausing So it was a turn off for listening to Podcasts But the touch controls were working perfectly when I connected it to my secondary Tecno Spark phone and pause and play was working perfectly Wonder why it wasnt the same when conected to my Samsung Smartphone Now I tried to use this Earbuds for listening to songs There was a wierd buzzing noise constantly occuring which is total turn off while listening to music But when I tried using it for longer this particular buzzing noise was noticed only in a very few songs in my playlist while other songs played as usual Unfortunately both my favourite songs that I played at first had that buzzing noise while using this earbuds Though the same songs play perfectly in other bluetooth earbuds But in general sound quality is good and clear And finally the only one good aspect about this Earbuds is the actual ease of using it was while on a call The sound quality was clear and the receiver was able to hear me properly so there is no problem with the mic too And as same as the pTron Earbuds in my earlier review in Amazon this one also looses connectivity just moving a couple of steps away from the phone which is another disappointment So far Boat Bluetooth Headset has been the best when comes to staying connected for a fair distance But considering most Bluetooth earbuds facing the same issue except a very few its manageable for most people Battery performance is good but cant say about the charging time as the device is yet to run out of charge First impression of battery is good It came with almost full charge out of the box and after a custom full charge before using I have not yet required to charge the device For every and a half hours of playback the battery gets reduced by which is quite good and promising Pros Good voice clarity and mic performance during a call Connectivity Sounds Competitive Pricing Build Quality Volume Increase and Decrease Touch Controls Cons Buzzing Noise while listening to music but only in few songs for reasons unknown Frequent disconnections due to poor Bluetooth range Bulky and Big Conclusion This Earbuds looks so promising with good build quality at a competitive price of Rs but there are a few performance issues which is not expected from an Amazon Basics Product I m not sure if I had received a defective product but after the initial impression this pair of earbuds performed much better overall when used frequently Thought of getting a replacement but it seems like a common defect for all so even if I go for replacement it will be having the same issue I guess So decided to use this as a backup for calls and some music as and when needed as a backup having got at Rs with so many offers and cashback bringing the price further down to reasonably a very affordable one Overall a very valuable purchase I must say Anyways at this price point its a good deal inspite of some imperfections when comes to performance Note Rated Stars from earlier Stars and updated the review after using it for an extended time period for the Build Quality and some innovations tried by Amazon Basics at a good affordable price Performance and touch controls seemed to work much better after using it frequently ,"basic earbuds,spare ear,huge fan,important thing,small medium,light weight,uncomfortable ptron,perfect fit,bulky size,next track,ok eventhough,little delay,daily basis,sound effect,disconnected voice,basic earbuds,disappointing thing,pleasant experience,sound quality,happy time",information
Zero Bass If u r a bass lover then just skip this no need to buy Only calm music can be heard on it clearly Vocals in background r not clear and the crackling sound is too much annoying Even if there is a very low bass in the music then this earbuds start crackling I m so annoyed that i felt if my eardrum has burst due to crackles Built quality is good look is good sound is high No bass crackles for small bass also bluetooth connect is very slow No response if box is opened Late finding of devices I have already returned this product instead gone for truke brand ,"calm music,vocal background,clear crackling,low bass,due crackle,good sound,small bass,truke brand",complaint
Using it from one week and feels it s an average Product as it get disconnected and using while call audio will not go to another person Mic has poor performance and Bluetooth has weak connection Only plus point is it has strong battery life ,"average product,poor performance,weak connection,strong battery",information
Headphones are good However Audio quality is average good for Mobile calls average for music Battery life is not as mentioned Headphones power discharge within hours Headphone case battery is good and lasts longer Overall good headphones at low price ,"audio quality,mobile call,average music,good headphone,low price",appreciation
Well for the price is got it it is quite an balanced product with somewhat decent build quality and decent sound experience Although it doesn t support AAC but SBC is also good and Battery Life is quite good compared to others like Ptron but the earbuds are bulky and too big to fit in my ear tho it may vary from person to person After using a period of time my ears starts paining cause these don t fit properly in my ears cause of its large size ,"balanced product,decent build,decent sound,good battery,big fit,large size",appreciation
Decent quality sound bass bluetooth looks,decent quality,appreciation
Some time Bluetooth connectivity Automatic lose ,automatic lose,information
This doesn t justify the Amazon basic quality product Build is definitely great and need to be appreciated but everything stops there the connection pairing and lighting mechanisms are pathetic One pair connects with another with a weird sound and unpleasing lighting Sound profile is mostly bass oriented and doesn t do justice to day to day listening of music and videos Battery indicators lights on the box are buggy they don t switch off sometimes even after a minute or so Wish I had put some more money and purchased a good quality product Above all the no return policy is the most annoying Need to be really careful while ordering anything online if a product is of poor quality customer should have all the rights to return and get the refund for it ,"basic quality,great need,weird sound,buggy switch,good quality,online product,poor quality",appreciation
Overall product is good sound quality is like premium earbuds and a decent amount of noise cancelation Microphone quality is also good but the problem is that the battery backup of the bud is around hr approx on percent of volume ,"overall product,good sound,decent amount,good problem,approx percent",appreciation
Need to upgrade the product not as I compared with others Bluetooth connectivity issue issue get disconnected automatically on sound during the call must work on the Bluetooth connectivity issue which rest design and casing is good enough but the only issue with connectivity,"sound call,enough issue",complaint
The media could not be loaded ,,appreciation
The media could not be loaded Very good ,,appreciation
Lighter than any other bluetooth,,appreciation
Its perfect for me Am happy except that sometimes the connection breaks intermittently and rest of the time works flawlessly Also this is a personal thing the buds are a bit large for my ears but that depends on individual to individual but just an info ,"personal thing,large ear,individual info",appreciation
awesome product in this rangebecause it s Made in India,awesome product,appreciation
Product is good Paisa basul nice kuwality,"good paisa,nice kuwality",appreciation
Connection,,appreciation
No bass and no clear saund ,clear saund,complaint
Sound quality is very Poor Music lovers Stay away from this product Can use it as a standby Product ,"sound quality,poor music,standby product",appreciation
Like,,appreciation
Sound very good bettery life goodBut plastic quality not good,"good bettery,plastic quality",appreciation
I bought this on Oct for Rs thinking that this would work for at least months The earphones worked for days and It s not recognisable by any leave in the nd week Tried with different phones iPad laptop The most irritating part is after sales It took about weeks for them to pick the product and process a refund I was going round in circles for weeks and when XOR technologies Manufacturer didn t respond to emails and calls I had to send screenshots of emails invoice and product images to get be able to get a return pickup ,"least month,recognisable leave,different phone,round circle",information
value for money,,appreciation
writing this review after almost hrs of use Got this at launch for Im guessing after initial phase amazon will increase price However I would be happy to pay even for this My Cons so far Packing is seriously substandard Its packed in a similar box a mouse is packed A basic corrugated paper box with earbud sticker on it Though this has nothing to do with performance of earbud but packing is first part of first impressions of a product Lights on case I personally didnt like it but i understand thats being most economical way to indicate battery status still Earbud Design Looks like from st generation of earbud Pros Sound Clear sound For me personally music at Volume was sufficient What earbud lacks in design it surely covers up in sound At full volume you could feel earbud is at its limit will crack up after months year of use Ease of Use Single tap volume controls double tap song change second hold play pause reject calls tripple tap voice assistant hold seconds power on off Its easy to use without accessing your phone Material Not premium but definitely neither cheap too Plastic feels good Since i got this at I can live with those cons give star rating At price its star product My Take Worth buying or less ,"initial phase,similar box,corrugated paper,first part,first impression,economical way,clear sound,personally music,full volume,single tap,double tap,second hold,second power,easy use,cheap plastic,live con",information
I bought them for and these are one of the best wireless earphones ever at this price point The sound is clear and loud enough The battery stays for long as mentioned hours The build quality is very nice and feels comfortable ,"wireless earphone,enough battery",information
Product was good but it was used product nd return item was used,,information
Over all ok but too much costIt don t deserve this price price have to be decreased,much costit,appreciation
The media could not be loaded Good at that price,good price,appreciation
Ok,,appreciation
Nice,,appreciation
Brilliant pair of earbuds,brilliant pair,appreciation
It s good ,,appreciation
 There are stupid noises when the buds pair with each other They sometimes pair with eachother if you have stopped playing music Noise cancellation mentioned in the description is not active the image is misleading Charging light on the case remains on till the buds have charged to Who thought of this idea Such a waste of energy super annoying The ear buds themselves also have lights to indicate pairing makes it look trashy Audio mic is decent in a quiet environment Please get rid of all these lights it ain t a Xmas tree Let me know if I can return it ,"stupid noise,active image,light case,annoying ear,quiet environment",complaint
Good battery backup and noise cancellation worth for money ,"good battery,worth money",information
The device doesn t automatically connect to the Bluetooth of your phone Everytime I have to pair manually and it s not an ideal feature And the grip is also not that good I d recommend to go for Ptron bassbuds lite which is a little big in size but works better than this ,"ideal feature,good recommend,big size",complaint
I purchased this just to get a feel of Wireless earbuds and I m not happy with my choice This does not fit my ear but fits my wife s ears So not for everyone Soundquality is very poor similar to that Rs headphones from Busstand and Railway Stations Noice Cancellation Similar to my wired Boat headphone nothing more than that Battery Good battery backupBuy this just for the same of having a true wireless buds not for any other reason ,"wireless earbuds,happy choice,similar r,wired boat,good battery,wireless bud",information
This earbuds is looking good and sounds quality is also best bass was super and feel d sound fitting was also great easily paired and battery performance is good i like this product more and you can also buy and feel real music sound,"good sound,best bass,real music",appreciation
For me these are average and somewhat uncomfortable Fell off more often Hurts your ears after using for much time The aound quality is not that good if you increase the volume you even the best quality audio becomes cringe Battery life is excellent Its good for indoor calling quiet places ,"much time,good increase,best quality,good indoor,quiet place",complaint
Bluetooth Connectivity is very Low Don t Buy this Product if you ve rs for this item You Can Add rs more rs and buy other buds better then this ,,appreciation
They have very best build quality of case and buds then any other products It can also charge faster then any other buds and have very long battery life and it also have very good bass and treble,"long battery,good bass",appreciation
they have a more neutral default sound profile which some users may prefer and their mic has a better recording quality They also have a low latency mode ,"neutral default,better recording,low latency",information
This earbuds is looking nice and good quality sound bass is was very amazing easily pairs and long life battery backup i suggest to buy this nice earbuds such a osume product i have see thank you amazon ,"good quality,long life,nice earbuds",appreciation
They have better built quality and they offer more comprehensive controls That said they also have better noise isolation thanks to their adjustable ANC feature ,"comprehensive control,better noise",appreciation
The sound is very balanced in the product Whether it is bass or treble or tunes everything is perfectly balanced Amazing product and a must buy Thanks Amazon ,"balanced product,treble tune,amazing product",information
Sound quality is good and battery backup is more than enough Over all value for money It s a good product You can buy this ,"sound quality,good battery,enough value,good product",appreciation
This Truly Wireless are better then any other Truly Wireless They are more comfortable and they have a longer continuous battery life Also their microphone has a better recording quality ,"continuous battery,better recording",appreciation
This are great for commute and travel Thanks to their lightweight and portable design you can easily store these comfortable and well built earbuds in your pocket or bag on the go,"great commute,portable design",appreciation
they have the same premium build quality as their other products They also have balanced and very punchy audio It s worth for its price,worth price,appreciation
While both buds are well built and have similarly excellent levels of noise isolation thanks to their ANC systems they have a better battery performance then any of others buds,"excellent level,better battery",appreciation
Bass is good sound quality is superb easily paired long life battery backup design is good I like this product more,"good sound,long life",appreciation
This earbud has huge scope of improvement for Amazon Basics Software need better bluetooth connectivity Design of buds weight of the earbud Functionality technologyMust say Amazon vendor did not give its to this product,"huge scope,basic software",complaint
A fantastic product by Amazon and I m very happy to have this one,fantastic product,appreciation
Good sound quality battery backup is also good bass is superb easily paired I love this product,"sound quality,good bass",appreciation
Sound quality is good long backup andlow weight ,"sound quality,long backup,andlow weight",appreciation
It s and Bluetooth device with heavy sound quality and nice noise cancellation,"heavy sound,nice noise",appreciation
Good product and nice quality clear bass worth of money,"good product,nice quality,clear bass,worth money",appreciation
Sound quality recommendable within this price range Sound quality super battery backup excellent and long lasting after use for many hours ,"sound quality,sound quality,super battery,many hour",appreciation
Great experience with this product ,great experience,appreciation
Loved the sound quality and the comfort of use Better than many other leading brands in the same price range,sound quality,appreciation
Worthy product for this price ,worthy product,information
Comport is so good Many times usable Sound is good Battery long period,"many time,usable sound,good battery,long period",information
It s good no issues with the connection as well ,,appreciation
Sound quality is supar no cut call after use bike very fast and easy Bluetooth connectivity and reasonable price ,"sound quality,reasonable price",appreciation
Superb No words,,appreciation
Sound quality excellent Perfectly designed ,sound quality,appreciation
Best earbuds at this price sound quality is awesome calling quality is also good ,best earbuds,appreciation
Sound quality awesome but noise cancellation was little hard otherwise worthy product,"sound quality,awesome noise,worthy product",appreciation
Best earphone product I purchased No tension after I purchased this Earlier boult cheated me with low quality neckband,"best earphone,earlier boult,low quality",appreciation
Product is really good Awesome,,appreciation
Vocals are very clear,,appreciation
Bluetooth connectivity is very good It didn t disconnect at long distance with the phone ,"good disconnect,long distance",information
Bass is very Good ,,appreciation
Superb quality nice design I like this product,nice design,appreciation
Not good one even ears are paining after some time and quality of call is very poor Not worth to buy,"good one,worth buy",complaint
Good Sound quality Active noise cancellation Good Battery life,"sound quality,active noise,good battery",appreciation
Overall good at reasonable price,reasonable price,appreciation
Amazing,,appreciation
Wonderful products and very Good sound quality I m very happy,"wonderful product,good sound",appreciation
Quality is very very poor not worth to the amount,worth amount,complaint
Product quality is very good I am very happy,,appreciation
Bad connectivityDrops call unintentionallyOnly positive thing it looks decently good,"bad connectivitydrops,positive thing",appreciation
Great product worth the price,"great product,worth price",appreciation
Packing good sound quality ok But it seems like there is some design flaw and particular beats found unbearably noisy Don t know whether it s defective product sent for me or everyone experiencing the same Recently my friend purchased noise vs While comparing this amazon basics Bluetooth earbuds with noise vs earbud noise vs is a clear winner in every aspect sound quality battery backup beats fit I am going to refund Amazon basics Bluetooth earbuds it s not upto the quality they mentioned in their ads Replacement update I have put replacement for this one and got new one delivered yesterday The noise i mentioned above exists with the new one also so it seems like there is a design flaw If you have this earphone and don t know what I m talking just play vainko song in YouTube with this earphone you can hear a noise in between beats that beat comes in different songs and in all the different songs you will experience an unbearable noiseDon t waste your money on a prototype product I am definitely going to refund my earphone ,"good sound,particular beat,defective product,clear winner,new one,new one,different song,different song",information
Connectivity issue Creating nuisance sound on high beats Very cheap product from Amazon ,"nuisance sound,cheap product",complaint
Sound is often breaking on call or music when battery comes below ,,complaint
It fit my ears well Sound is clear even though I could hear what others were talking in the room I think battery life is good too It was worth the money i paid for it ,"fit ear,worth money",information
Very uncomfortable in the ear And Gets disconnected easily unexpectedly,uncomfortable ear,complaint
There are some stupid noises coming from earbuds Amazon has cheated its customers to give a good earbuds and I believed in their products and finally concluded that Amazon is a big cheater I suggest you that this earbuds are suitable for use I give a final advice is that don t buy this products in online like Amazon platform instead try buying outside at a popular places where earbuds are good and even u can try physically there ,"stupid noise,good earbuds,suitable use,final advice,popular place",complaint
Audio quality on call is so bad and connectivity is also not goodI have requested for replacement and not replacement done in app it s showing deleverd what happened with Amazon,"audio quality,bad connectivity",complaint
Misc play wath not working,,complaint
Good,,appreciation
Only one side getting connected Tried so many times Don t know why but even it is full charged and there is no service seems to be available nearbyAlso sensor of left earbud is continuous onLight of box is not getting off,"many time,nearbyalso sensor",complaint
It doesn t work during high beat music and suddenly there is no sound at certain times,certain time,complaint
i like the product Amazon TWS is a perfect tws in the market in this price it s bass is clear sound quality is good Amazing battery backup,"sound quality,amazing battery",appreciation
Value for money product,,information
Overall disappointed,,complaint
Weast of money please take boat or any brand,,appreciation
The media could not be loaded First of all I would say the earbuds dnt work as expected Stuttering sound if I watch a series or movie Call disconnects automatically while talking And as its own wish it disconnects and connects Bluetooth Above are the problems faced But I tried connecting the retailer they said contact Amazon Amazon doesn t have options to raise issue and send it back Feel cheated by amazon Looks like a faulty earbuds given to me and no one to assist ,"cheated amazon,faulty earbuds",complaint
Review after month usage Sound during calling is very low It restart app during connecting and disconnecting very bad Connectivity takes time,bad connectivity,information
The media could not be loaded SOUND QUALITY IS VERY LOW AND DON T PICK UP PHONE WHILE TURN ON BLOOTOOTH,"sound quality,low pick",appreciation
In general the quality of Amazon Basics products is good but these earbuds are a worst product from Amazon Basics I received faulty earbuds Quality checks are required at packing facility Have returned twice ,"general quality,basic product,good earbuds,worst product,faulty earbuds",complaint
No ,,complaint
Bhai m jada kuch bhi nahi kahunga bas yahi kahunga ki no hai iski sound quality or bass quality ,sound quality,appreciation
DON T THINK TWICE YOU SHOULD OWN THIS I AM SURPRISED ABOUT THE SOUND QUALITY AWESOME,sound quality,appreciation
Fully satisfiedVery happy with it s sound experience,happy sound,appreciation
Noise should improve more,,appreciation
Good very Amazon,good amazon,appreciation
It has a good battery back up and very nice sound,"good battery,nice sound",appreciation
Really amazing TWS loved it Best buy under k,,appreciation
Very good material and good item,"good material,good item",information
Very light weight and comfortable,light weight,appreciation
Superb bass and Sound quality,,appreciation
Product is good but couldn t fit into my ears falls down frequently,fit ear,appreciation
It s connect with phone quickly and sound quality is also good over all a good but with this price and noise cancellation is the good and battery life ok,"good price,good battery",appreciation
Too good,,appreciation
Awesome product impressed with the sound quality ,"awesome product,sound quality",appreciation
