comments,about,topic
Value for the money Sounds is clear and bass is great also very light weight,"clear bass,light weight",appreciation
 Pros Great Sound Good Battery Great Price Cons mic is not that best but ok with this price range ,"great sound,good battery,great price,ok price",appreciation
Earbud quantity is very bad when ware in ear no wareing in ear automatically down and fall down i m also request for return but amezon direct refused complaint and not take back this worst product,"bad ware,worst product",complaint
Sound quality is good,sound quality,appreciation
Best product you can buy in this range Sound quality is good,best product,appreciation
Late connection,late connection,appreciation
Happy to purchase it In this price segment it s really good,happy purchase,appreciation
This is definitely one of the best sounding TWS at this price point I am amazed by the sound quality ,amazed sound,appreciation
Tried other TWS under but this one is way better than them Must try,,complaint
great product at this affordable price quality of the product is grt,"great product,affordable price",appreciation
I like this product Very good sound quality and very good product for all mention in description ,"sound quality,good product",information
Amazon basics Bluetooth bhot karb product hai or Amazon ki policy hai ye product pe day me replacement but mene Amazon basics buy kiya or usme right side ka earbuds kam nahi karta or touch controls be ekdam kharb hai bhai ye product buy mat karo,"mene amazon,right side",information
Looks premium and call quality is also good and top notch sound quality in this price range,"premium call,top notch,sound quality",appreciation
Good sound quality and battery life,sound quality,appreciation
Working as expected for now Will let you know the durability after months ,,information
I really like the product Fits in ear perfectly Sound is also fine,,appreciation
Low price best headphones,"low price,best headphone",appreciation
Sound Quality is extremely good ,,appreciation
 Only amazon can give high quality products in this price range This TWS is extremely good Anyone can have TWS now ,high quality,appreciation
Over all good package in this price battery backup and sound quality was good ,good package,appreciation
I have redmi and noise tws but these ones are the best among all ,,appreciation
Hariom KumarAmazing products nd service by Amazon Must Buy it s better then my previous buds ,previous bud,appreciation
Sound like premium one and best qualityOther any product,qualityother product,appreciation
Excellent product good earbuds design and looking very good easily fitting in ears,"excellent product,good earbuds,fitting ear",appreciation
Worth the price although i have bought it in ,worth price,appreciation
Everyting is great great product in this price range,great product,appreciation
Don t buy these earphones using them has caused problems in my ears It always has a crackling and static noise coming from it along with the sound They re not at all noise cancelling and are made of very low quality ,"static noise,low quality",complaint
Disription Delivery boy and time is very good Also the product is so nice ,,appreciation
Product is exactly what it shows with good quality ,good quality,appreciation
Amazon basics have raised their bar on quality and finishing Sound and connectivity is awesome Battery back up to be checked Looks promising ,awesome battery,appreciation
Worth with this price,worth price,appreciation
Connectivity is very poor also not an a month it s damnged,,complaint
Compact and light weight great connectivity and range,"light weight,great connectivity",appreciation
Good earpods Sound quality goodBudget friendly I took it in saleColour very good Even the replacement process from Amazon is very smooth Thanks Amazon ,good earpods,appreciation
Best and rich in all aspects,rich aspect,appreciation
Sound quality is super Balanced sound not too much bass ,"sound quality,balanced sound,much bass",appreciation
I totally like the product,,information
Product build and sound quality are good,sound quality,appreciation
Nicely working good quality and light weight,good quality,appreciation
Sound clarity is awesome Worth of money,"sound clarity,worth money",appreciation
Just amazing productComplete value of money,productcomplete value,information
A must buy products for music lovers,,appreciation
Bass sound and quality everything was good,,appreciation
Good sound quality battery life is also ok,sound quality,appreciation
This TWS sounds good and decent,good decent,appreciation
Excellent sound quality with a comfortable fit,"sound quality,comfortable fit",appreciation
Great quality product at great price and very good punchy bass,"great quality,great price,punchy bass",appreciation
Highly recommendedThe price is taken it s worth it,recommendedthe price,appreciation
Vocals are good for the price with balance bass and treble,good price,appreciation
The quality of music is too clear with every detail,,information
 Amazing Sound Quality Great Battery Backup Best Value for money under Rs Build quality is perfect,"sound quality,great battery,best value",appreciation
sound is clear with good battery backup,good battery,appreciation
All rounder best ear buds under ,,appreciation
Nice earpods at that price Great audio experience with immersive sound ,"nice earpods,audio experience,immersive sound",appreciation
Sound quality is Good Bass quality is Good ,"sound quality,good bass",appreciation
One of the best value for money product,best value,information
Best deal on amazone perfect trebles with bass,treble bass,appreciation
Better than any other brand in this price range ,better brand,appreciation
Touch sensitive buttons on earbuds are very sensitive ,sensitive button,information
Vocals are pretty good and clear,,appreciation
Superb sound quality and battery backup,sound quality,appreciation
The sound quality is good convenient and affordable price to buy it ,"sound quality,affordable price",appreciation
Nice sound quality Clean design ,"sound quality,clean design",appreciation
One line best in this range,best range,information
Fabulous purchase ,fabulous purchase,appreciation
Sound quality is amazing Perfectly fits in ear size is good Overall value for money,"sound quality,fit ear,overall value",appreciation
Awesome bass and battery backup,awesome bass,appreciation
Amazing buds with great sound,great sound,appreciation
Using it during my workout No problem faced till now Doesn t fall,,appreciation
Amazing product u can buy instead of ptron and noise,amazing product,appreciation
Mind blowing earbuds decent bass with clear vocals,"decent bass,clear vocal",complaint
It is amazing product with no problem Also pairs very fast,amazing product,appreciation
Good sound with nice ear fitting,"good sound,nice ear",appreciation
Sound quality is Fantastic ,sound quality,appreciation
I love the base and quality Thanks for the quick delivery ,quick delivery,appreciation
Such an excellent sound earbuds ,excellent sound,appreciation
best earbuds at very affordable price,"best earbuds,affordable price",appreciation
Amazon basics products are best everytime Good performance,"basic product,best everytime,good performance",appreciation
Best in battery Sound is best money is good ,"best battery,best money",appreciation
Sound quality is amazing ,sound quality,appreciation
Very Good Product,good product,information
Product is soo good I loved it,,appreciation
Fabulous products worth it,fabulous product,information
Very good connectivity and good sound experience,"good connectivity,good sound",appreciation
Awesome Buds are lightweight very comfortable to use ,comfortable use,appreciation
One bud sounds low i replace time but it same first one right bud sounds low and second time left bud sounds low,"low replace,second time",information
satisfied with sound quality,sound quality,appreciation
Amazing sound and good build quality Best purchase for the price ,"good build,best purchase",appreciation
Battery life and sound quality is very good,,appreciation
The media could not be loaded No,,appreciation
Worth buying this ,,appreciation
The media could not be loaded Products nice all future nice,nice future,appreciation
Extremely comfort earbuds It doesn t fall off ,,appreciation
Build quality is excellent as well as noise cancellation ,,appreciation
Amazon blutooth ka dekha ta par anda koye marka ka nhi rehta hain blutooth nhi Lena bhai Amazon ab baikar product delivery karwota hain plz Amazon mat us karo use achha Flipkart hai,,appreciation
This product is a piece of trash buy at ur own discretion Connectivity issues gets disconnected as n when the device feels like Amazon basics products are a result of poor R D ,"basic product,poor r",complaint
The media could not be loaded ,,appreciation
I tried to play music in these earbuds music is not continuous It breaks in between like short gaps and eventually you will get irritated Latency is too high There is no return no support for this item even ,"continuous break,short gap,irritated latency",complaint
The media could not be loaded ,,appreciation
awesome earbuds,awesome earbuds,appreciation
Good product,good product,information
Worst product having connection issues very less battery backup sound is also flat please don t buy this,worst product,complaint
Product quantity is not good after days left earbuds not work properly,good day,complaint
don t get fooled by the price and get this This is way too bad It is made with scrap plasticand sounds way too sharp like it might literally tear your ear There is no replacement too there was only return toooo bad,,complaint
The worst quality ear buds i ve ever bought disfunctional from the very first day the sound quality is bad and the material and build quality is the cheapest,"worst quality,first day,sound quality,bad material",complaint
Voice fat rhi h,,information
Doesn t fit properly in the earSound also not goodConnecting issueWorst productThis is worth of rupees only not Cheap quality,"issueworst productthis,worth rupee,cheap quality",complaint
Sound not good,,complaint
Service is very Very bad ,,complaint
The media could not be loaded Very poor sound quality I want to change my earbuds but there is no option show for return or claim warranty very pathetic products quality,"poor sound,pathetic product",complaint
Auto disconnect and sound is not good Size is bulty Pain ears,"good size,bulty pain",complaint
Within days of use one bud stop working No warranty support from Amazon for this product ,,information
At first sound quality is too much disturb From meter distance it isn t working The product can t return so they replace today but this also is same ,"sound quality,disturb meter",complaint
The product is not working and it is very low quality product,low quality,appreciation
 th class item,,information
Yah product bahut bekar hai Isko Nahin kharide,,appreciation
Not good,,complaint
Left side ear bud not connected,,appreciation
All are defective,,complaint
Connection problem after days,,information
Connectivity problem,,complaint
Bekar cheez ,,appreciation
Only one earbud was working,,complaint
The product don t connect automatically It says failed to connect and one of the ear but stopped working,,complaint
The earbuds stopped working within week of purchase very bad experience How can i replace it ,bad experience,complaint
Waste of time Money ,,complaint
Defective quality charging not working properly ,defective quality,complaint
Kharab ho gaya,,appreciation
This is wast your money,,information
Connectivity is not good ,,complaint
Worst one ever,,complaint
Very bad,,complaint
No well sound breaks every time poot connectivity old used item Sent to me,sound break,complaint
Bass fata rah ha,,appreciation
Waste product,,complaint
West of money no good so far,,complaint
Sound quality very bad,sound quality,complaint
Ear buds not working well,,complaint
Sound quality is very bad ,sound quality,complaint
Bad quality,bad quality,complaint
Worst to the core,worst core,complaint
Amazon name also they can t print proper printing,proper printing,information
Battery life only hr Bad battery quality,bad battery,complaint
The media could not be loaded CentralProduct,,information
Main ishko week se use kar raha hun accha hain sound avarage hain calling main bhi issues Nehi hain connectivity accha hain disappointment ka kuch issues Nehi hain Ek problem mujhe laga ishka led indicator bohot time Tak jalga rehata hain Or bohot bright hain yaarItna time Tak jalne ka kya fayda hain Baki sab sehi hain Review video available hain YouTube PE RelyOn channel ka nam hain checkout kar sakte hain,"main ishko,main bhi,fayda hain,available hain",information
Quality is sub par,,appreciation
Good tws product which is a value for money product from Amazon at a great price point for these specs,,information
The media could not be loaded Very much quality and help Full sound quality is best tuch control water proof so very much quality and help,"much quality,sound quality,tuch control,much quality",appreciation
Frequently skips audio playback as it fails to maintain a steady connection despite the PC or mobile being within arms reach Audio quality is average I tried returning the product upon delivery but they said they can only do a replacement I wanted to leave a feedback immediately to warn others but the app didn t let me The customer care executive gave me a generic email to forward the complaint I didn t follow up There were no reviews for this at that time possibly for this reason They simply wanted people to trust Amazon and buy it and make a lot of money during Prime Days More than anything else I hated not being able to post a feedback I feel that they abused their position as gatekeepers ,"audio playback,steady connection,audio quality,generic email,prime day,able post,abused position",complaint
I really had lots of hopes in this product When it arrived it was working great worth the price But later I discovered it has really small grip and doesn t fit well with any size of ear buds There is no refund for the product only exchange At least they could have exchanged a product with some other model Never going to buy a Amazon basic product You can compare the ear phones grip with this product ,"worth price,small grip,well size,basic product",information
Not Good enough sound may be not clearly quality is not maintained in this product ,enough sound,appreciation
Sound Quality is good and Buds do not fall off from Ears Play time of earbuds are very good,"sound quality,good bud",appreciation
Tried boat earlier But this one is better than that Amazon never disappoint us,better amazon,information
Noise cancellation works great but not in too noisy environment Overall super cool deal ,"noisy environment,cool deal",complaint
Sound quality is very good,sound quality,appreciation
Clear sound quality with loudness ,sound quality,appreciation
Quality and battery life of the product is good ,,appreciation
Sound quality of this earbuds is really good and I appreciate the it I am satisfied with this product as it has good power back up also,"sound quality,good appreciate,satisfied product,good power",appreciation
Excellent Awesome product happy to buy it ,"awesome product,happy buy",appreciation
Nice product sound quality is excellent and blue tooth connectivity very easy,"nice product,blue tooth",appreciation
Decent product simply you can go for it,decent product,appreciation
Sound clarity is superb You can hear low to high vocals clearly,"sound clarity,high vocal",appreciation
Really useful for music lovers Quality is superb no one can tell you that you have purchased it for ,useful music,appreciation
Very very nice sound,nice sound,appreciation
