BankURL,UserName,ReviewRating,UserLocation,ReviewTitle,comments,ReviewDate
panaceafinancial.com,Nicholas Heiser,5,US,Awesome for new doctors,"Everyone was extremely helpful and made the process painless.  I love that they understand the financial struggles that graduating medical students and new residents go through and have programs specifically for that.  I had a decent amount of credit card debt from all of the expenses involved with school, and wanted to pay that off and have some money left over for moving expenses to my residency.  Panacea's loan was perfect for this, and the fact that I don't have to start payments until after the first year was great.","Date of experience: April 05, 2022"
panaceafinancial.com,Jesus,5,US,I can??t even begin to count the amount?,I can??t even begin to count the amount of banks and credit unions that denied me a loan during medical school for residency applications and moving expenses due to my medical school loan burden. The only option I had were high interest credit cards that have taken over most of my spare income. Panacea was extremely helpful throughout the application process and at last been able to qualify for a loan to pay off the credit cards that have been burying me. I finally feel like I have breathing room and am thankful a financial institution like this exists to assist early career physicians and residents.,"Date of experience: June 24, 2022"
panaceafinancial.com,Ryan K,5,US,Best experience ever,They made everything run so smoothly. My banker Alex took the time to answer all my questions and checked in with me regularly. Felt very taken care of and I know I will continue working with them because of the level of service I received.,"Date of experience: July 06, 2022"
panaceafinancial.com,Tigress,5,US,Residency relocation loan,"I was contacted the same day I made an inquiry. My primary banker was very helpful in explaining the plan products and conditions. I received loan within 10 days of applying. Everything went smoothly and loan terms are fair, will definitely recommend!","Date of experience: June 13, 2022"
panaceafinancial.com,Christian Martinez,5,US,Excellent experience,Excellent experience. Fast and efficient process. Always willing to help and answer to questions and concerns. Great interest rates. Raquel Powers was extremely helpful during all the process. I recommend it to anyone who needs a Student Loan Refinancing.,"Date of experience: May 27, 2022"
panaceafinancial.com,Alexey Ryskin,5,US,From start to finish,"From start to finish, very efficient, great communication and help getting the loan quickly. Panacea was supportive every step of the way. Got my loan with 10-14 days. Great experience. Thank you!","Date of experience: September 07, 2022"
panaceafinancial.com,Dr. S Fields,5,US,Alex was amazing!,Alex was amazing! He made this process super easy for me during a very hectic transition from medical school to residency. I appreciate everything he and the team at Panacea Financial did for me and would definitely use their services again!,"Date of experience: June 24, 2022"
panaceafinancial.com,Samantha Turner,5,US,4th Year Medical Student Loan,"Mr. Alex Kugler and the entire Panacea Financial team were absolutely fantastic! I have truly never experienced customer service from a bank like I have with Panacea. Their 4th year medical student loan was so fast and easy to obtain! I highly recommend them for any fourth year medical student who has matched and needs extra funds for moving expenses/ to pay off any debt obtained during fourth year of medical school. This company has the best rates for all loans/refinancing of loans/checking/savings accounts on the market, and I am so happy that I decided to bank with them!! Cannot recommend this company enough!","Date of experience: June 08, 2022"
panaceafinancial.com,Bretty Aziz,5,US,Overall wonderful experience,"Customer service was great, very kind and accommodating. The process was stress free and my banker was more than happy to answer any questions I had.  The application was simple to complete and the funds came quickly.  It's a great option for people in the medical field.","Date of experience: April 12, 2022"
panaceafinancial.com,Doris Canes,5,US,Excellent experience with Panacea?,"Excellent experience with Panacea Financial. I am a medical resident. Alex was my primary care banker. I can't thank him enough for helping me and guiding me during this process. I got my PRN loan approved, and the fund was in my checking account in less than 48 hrs.","Date of experience: April 18, 2022"
panaceafinancial.com,David,5,RS,Truly a VIP experience,"Truly a VIP experience.  Panacea has a concierge phone number with actually a real person who answers your call rain or shine. Beside of that number. they actually assign a personal banker who knows you well.  It is very convenient especially for busy professionals. I moved my banking from a large institution to Panacea which saves me tons of time by not being required to be at physical location; able to do my transactions wherever I am, without being in a long  waiting line. Imagine working late and able to reach someone long after the normal daytime hours  to help you do your banking transactions , when most banks are closed. That is such a nice unique  privilege.","Date of experience: July 14, 2022"
panaceafinancial.com,Dr. KR,5,US,Amazing service for fully licensed?,"Amazing service for fully licensed physicians, residents and medical students alike! Panacea distributes your funding within hours of signing your loan documents and do not give a penny less than what you applied for!","Date of experience: July 28, 2022"
panaceafinancial.com,Angie Saulabiu,5,US,Great experience with Alex,"Alex was my primary banker and he was amazing! Communication was perfect, I was kept in the loop for everything and he went above and beyond to make sure I got what I needed. Can't recommend Alex and Panacea enough. I am thankful and grateful.","Date of experience: May 31, 2022"
panaceafinancial.com,Michael M,5,US,Raquel Powers did an amazing job?,"Raquel Powers did an amazing job helping me find a loan that was suited to my needs, walking me through each step, and then helping me to create a checking account. Really outstanding communication! (Note, I never write reviews so I was genuinely impressed).","Date of experience: April 19, 2022"
panaceafinancial.com,Imran Ali,5,US,It is great experience to speak with?,It is great experience to speak with agents of panacea financial. Very reasonable rates to pay and important thing I have to pay only 7.5% interest and don??t have to pay capital amount in first 2 years . I would recommend to everyone,"Date of experience: June 22, 2022"
panaceafinancial.com,Rachael,5,US,Great for a medical school to residency transition loan,It is really hard to navigate the time when you are transitioning from medical school to residency financially if you do not have rich parents. You have too many loans to get a personal loan from a regular bank and cannot consolidate your student loans until after your medical school submits the documentation that you have graduated. Panacea financial is one of the few financial institutions that understand this and does not hold it against you. They were very easy to work with and I can thank them for being able to put a security deposit and first month's rent down in the area I am moving to for residency.,"Date of experience: May 06, 2022"
panaceafinancial.com,Tom Latosek,5,US,Panacea and specifically Parker were?,Panacea and specifically Parker were extremely helpful with helping me refinance my private student loans! The customer service I received exceeded all of my prior banking experiences.,"Date of experience: July 30, 2022"
panaceafinancial.com,Saul Morales,5,US,"Easy process, great customer service",Needed a loan for debt consolidation. Raquel Powers was my primary care banker. She was very helpful. The application process was straightforward and only took a few days to get the loan approved/funded.,"Date of experience: August 10, 2022"
panaceafinancial.com,John Park,5,US,I'm graduating from dental school in?,"I'm graduating from dental school in June but I needed some extra finance for living expenses until licensed. I'm very pleased and grateful to Panacea Financial. All team members are professional, efficient and friendly. Definitely recommend.","Date of experience: May 11, 2022"
panaceafinancial.com,Peter Botros,5,US,Great experience all-around,"Great experience all-around. Quick and easy loan application with all the essentials, great correspondence by the team. Thank you guys for everything, following up with all emails and making the process super smooth. Highly recommend.","Date of experience: June 02, 2022"
panaceafinancial.com,DG,5,US,Excellent all-around,"Excellent response time, very respectful, and highly committed to helping achieve what I needed. With them understanding the lives of healthcare professionals and curating their business towards them, I would highly recommend them as your first choice.","Date of experience: April 06, 2022"
panaceafinancial.com,Zachary Baird,5,US,Truly a phenomenal experience,Truly a phenomenal experience. Application process was easy and the entire process only took 1 week. All staff members were friendly and easy to work with. Highly recommend for physicians/healthcare professionals in training.,"Date of experience: June 17, 2022"
panaceafinancial.com,third year IM resident,5,US,3rd year IM resident,"I researched this service extensively prior to using them to ensure they were not a scam. They are a division of Primis bank and legitimate. What you see on their website in regards to personal loans is what you get. Simply made a an online account on their website, uploaded required documents, and someone emailed me within a couple hours with a banker. All questions were answered through email and was invited to speak over the phone if I wanted. Everything was approved over the course of a couple of days and I received funds same day as signing my contract. Would recommend to my colleagues and would use again if necessary","Date of experience: April 14, 2022"
panaceafinancial.com,V.MD,5,US,Friends staff,"Friends staff, prompt responses with frequent reminders, updates; organized. access to staff 24/7 with < 24 hr response by primary account manager. professional. amicable. highly recommend exploring services offered by company.","Date of experience: May 12, 2022"
panaceafinancial.com,Matthew Emeka,5,US,good experience from happy costumer?,good experience from happy costumer totally satisfy with your services,"Date of experience: December 22, 2021"
panaceafinancial.com,Steven Wells,5,US,A Marvelous experience,I had a great experience with the team at Panacea financial. Raquel was awesome. She walked me through each step and patiently answered all my questions. What a delight. I highly recommend them.,"Date of experience: August 01, 2022"
panaceafinancial.com,Robert,5,US,Don??t look anywhere else!,Refinancing my loans could not have been easier. A few emails and text messages and a check was sent over to get rid of my high federal interest rates. I can see Panacea becoming our programs go to company for loan refinancing.,"Date of experience: April 14, 2022"
panaceafinancial.com,Jerel,5,US,It??s just as advertised,It??s just as advertised. A bank just for doctors. It was a seamless process to refinance my private loans and provide me with some temporary financial relief while I complete my training,"Date of experience: August 13, 2022"
panaceafinancial.com,Anna Seime,5,US,5 star experience,I had a fantastic experience working with Panacea and my banker Rob Borcherding! They worked with me every step of the way to help make my dream of purchasing my own dental practice a reality. I recommend them without hesitation.,"Date of experience: March 31, 2022"
panaceafinancial.com,Touleen,5,US,Med student loan,"I was able to get a medical student loan with no co-signer, and my primary care banker walked me through the entire process and stayed in touch with me the entire time and answered all my questions. Highly recommend.","Date of experience: May 14, 2022"
panaceafinancial.com,rider,5,US,Wonderful experience,"Wonderful experience. Strict with requirements around training level/status but very smooth, fast and responsive. Less than a week from start to finish. Raquel was great to work with! Highly recommend.","Date of experience: July 01, 2022"
panaceafinancial.com,Casey,5,US,Pancea was incredible,"Pancea was incredibly fast and easy, they approved my loan and my banker was incredibly responsive. If I ever need another personal loan I couldn't imaging going elsewhere.","Date of experience: August 24, 2022"
panaceafinancial.com,AS,5,US,Very responsive,"Very responsive, polite, and informative. I was aware of what was going on with my application the entire time. Process of obtaining a loan and setting up autopay and the accounts was a breeze.","Date of experience: July 02, 2022"
panaceafinancial.com,Derek Liu,5,US,Alex Kugler was fantastic!,"Alex Kugler was a fantastic banker! He went above and beyond, answering all my questions promptly and in-depth. I appreciated him jumping on the phone with me to discuss my options, and for his attention to details.","Date of experience: April 04, 2022"
panaceafinancial.com,Wesley,5,US,Seamless and highly personalized,Seamless and highly personalized experience with excellent customer service!,"Date of experience: November 20, 2022"
panaceafinancial.com,Kay,5,US,Everyone I interacted with was kind,"Everyone I interacted with was kind, helpful, efficient and knowledgeable. I truly felt like everyone worked hard to help me figure out and secure the best option for me. Highly recommend them.","Date of experience: June 20, 2022"
panaceafinancial.com,Johnathan Emahiser,5,US,Love it,"Love it. Very competitive interest rates on checking/savings, fair interest rates and grace period on PRN loan, and excellent customer service. Would recommend. Almost worth going to medical school to get it.","Date of experience: April 09, 2022"
panaceafinancial.com,Spinosaurus D,4,US,Panacea really helped me when I needed?,"Panacea really helped me when I needed it. I got denied a loan by my bank, but Panacea was able to assist me. The contact person was also very nice and assisted me with every question I had.","Date of experience: June 22, 2022"
panaceafinancial.com,Alexandra Lentz,5,US,Great service!,"The refinancing experience was easy, and Raquel was a great help! Very responsive whenever I had questions and friendly service whenever I needed it. Not to mention a great interest rate for my loan!","Date of experience: May 18, 2022"
panaceafinancial.com,Megan Young,5,US,Awesome experience,Alex was very helpful and guided me with each step. He was thorough and provided excellent communication so there was no long periods of waiting or not knowing what to do next. Highly recommend.,"Date of experience: June 06, 2022"
panaceafinancial.com,Arjun Arya,5,US,Incredible.,"I mean what can I say, easily the most incredible experience I??ve ever had with a bank. The personal banker situation is fantastic, service is excellent, everything is easy - really, the way things should be.","Date of experience: April 04, 2022"
panaceafinancial.com,Praise Matemavi Mamadoc,5,US,Hands down best bank for physicians,"Hands down best bank for physicians. For those that are fresh out of training and wanting to get back on track with their finances avoiding crushing interest rates, this is the way to go!","Date of experience: June 23, 2022"
panaceafinancial.com,Lucio Palanca,5,US,"Search no more, this is the place to be","I was searching for a place to get help for additional funds to expand my practice.  I always get flyers in the mail but tend to ignore them as I thought that I would never need them.  Then this opportunity came around which I could not pass.  I have funds but were tied up in other investments, so I needed some quick cash.  After a brief search, I found Panacea.  I also checked out other sites and narrowed my choice to 2.  I applied to both and one thing I can say with Panacea is that when comparing their rates and the ease of transactions, specially with the assistance of  my primary banker Parker Beller, the process was quick and painless.  I would definitely use them again should the need arise and would also recommend them to anyone","Date of experience: April 27, 2022"
panaceafinancial.com,gabriel,5,US,Alex Kugler,"My primary banker, Alex, was excellent! He was able to take care of my loan processing in a swift and efficient manner. I am happy with this experience.","Date of experience: September 14, 2022"
panaceafinancial.com,Omar Nagy,5,US,Excellent experience,Very impressed with Panacea Financial. Professional staff and efficient underwriting team. Would definitely recommend to any physician. I am excited to see new products added in the near future.,"Date of experience: May 06, 2022"
panaceafinancial.com,Sam Wood,5,US,Thank you!,"Alex has been fantastic to work with. Communicative, efficient, and honest. The application was simple and my funds were deposited promptly. I really appreciate the help guys!","Date of experience: July 05, 2022"
panaceafinancial.com,Allison Breda,5,US,Highly recommend,This process was so easy and painless.  I really appreciate the availability and efficiency of everyone involved.  All of my questions were answered in a timely manner and everyone was so kind.,"Date of experience: April 05, 2022"
panaceafinancial.com,AS,5,US,Truly exceptional!,My experience with Panacea was truly exceptional. My primary care banker was quick with replies and just so helpful in the overall process. Panacea is a blessing!,"Date of experience: August 04, 2022"
panaceafinancial.com,Jenny,5,US,Great experience,Rob and the team at Panacea were wonderful to deal with.  Very professional and knowledgeable.  I would highly recommend them.,"Date of experience: October 14, 2022"
panaceafinancial.com,Samantha Olvera,5,US,I??m so happy with the service provided?,I??m so happy with the service provided by Panacea. The whole process was very straightforward and my banker was able to explain things to me step by step before obtaining the loan.,"Date of experience: May 18, 2022"
panaceafinancial.com,Christine,5,US,Rob made the practice purchase?,Rob made the practice purchase experience a breeze.  So helpful throughout all aspects.,"Date of experience: November 21, 2022"
panaceafinancial.com,Jenna T,5,US,Financial Relief is an understatement! Kind and quick process!.,Very kind and knowledgeable. So incredibly grateful this company exists! I have felt a lot of financial relief as I have more support for my life during my training!,"Date of experience: June 16, 2022"
panaceafinancial.com,Jerry,5,US,"Timely, professional, and transparent","Finally a bank that understands the unique financial needs of medical students, residents, and attendings! I applied and was quickly approved for the PRN loan to help with moving expenses and to consolidate some high-interest credit card debt. I was denied loans by other banks due to my subpar credit score and high student loan debt. Once approved, the funds were wired to my bank account the same day. Absolutely amazing customer service. Raquel and Zaria were fantastic. They kept me updated while my application was being processed and made the whole experience a breeze. I even received an email from one of the co-founders, Dr. Palmer, at 4:30 AM EST when I was initially applying because there was an issue with verifying my cell phone number. This is truly unparalleled customer service that I??ve never experienced with other financial institutions. I couldn??t be more grateful!","Date of experience: June 09, 2022"
panaceafinancial.com,GE,5,US,Parker did an incredible job and was?,Parker did an incredible job and was super attentive and kind. I appreciated everything he did for me. What an amazing experience.,"Date of experience: August 28, 2022"
panaceafinancial.com,Justin Smith,5,US,James Burnett responded promptly and?,James Burnett responded promptly and kept me updated during all steps of the loan process. I would recommend him and this service to other colleagues.,"Date of experience: July 09, 2022"
panaceafinancial.com,Mohammad Khan,5,PK,Excellent Service they assign you a?,"Excellent Service they assign you a personal banked, mine was always available and straightforward about the whole process. 100% would recommend and would use again!","Date of experience: April 15, 2022"
panaceafinancial.com,Phil,5,US,Simple loan process,Panacea??s PRN loan helped me pay off high interest credit cards and save me money. The application process was quick and easy.,"Date of experience: September 13, 2022"
panaceafinancial.com,Cole Bergeron,5,US,Incredible service,The team at Panacea Financial went above and beyond to help me during a difficult time in residency. I felt supported in every step of the process.,"Date of experience: June 23, 2022"
panaceafinancial.com,Kristian Rosario,5,US,Service was amazing,Service was amazing! Raquel helped and guided me through everything. The process to refinance was easy and quick. I couldn't be happier with the result.,"Date of experience: May 19, 2022"
panaceafinancial.com,Siobhan o Donnel,5,IE,Great experience,,"Date of experience: December 26, 2022"
panaceafinancial.com,PRISKA TEE,5,ID,satisfactory service,"satisfactory service, friendly and very helpful staff, the process is also fast and problems can be resolved quickly","Date of experience: September 03, 2022"
panaceafinancial.com,Anonymous,5,US,Had to have use credit cards throughout?,Had to have use credit cards throughout medical school and beginning of residency. This helped me get out of that debt and gave me peace of mind,"Date of experience: May 19, 2022"
panaceafinancial.com,Anthony K,5,US,Great customer service through and?,Great customer service through and through. This is so hard to find nowadays. I??d definitely recommend to colleagues in the future.,"Date of experience: July 21, 2022"
panaceafinancial.com,Sunnie,5,US,Great Experience,Alex Kugler and Rob Borcherding were great partners in making my hopes become a reality. They are so personable and easy to work with. Thank you!,"Date of experience: April 09, 2022"
panaceafinancial.com,Steven,5,US,Excellent experience,Excellent experience. Was able to get the loan amount needed at a rate lower than anywhere else to help with M4 to Residency transition costs.,"Date of experience: April 13, 2022"
panaceafinancial.com,Jeffrey,4,US,Everything great so far Concierge very?,"Everything great so far Concierge very friendly,  just waiting for my initial deposit to show.","Date of experience: October 21, 2022"
panaceafinancial.com,Jay,3,US,Application would not allow me to?,"Application would not allow me to change info, which caused application process to take a week.","Date of experience: October 08, 2022"
panaceafinancial.com,A Karim,5,US,Truly a remarkable experience,Truly a remarkable experience. Raquel went above and beyond to ensure my application was approved in a timely manner. Thank you!,"Date of experience: June 20, 2022"
panaceafinancial.com,Brett,5,US,Overall would highly recommend,Company representatives were helpful throughout the transaction. Would highly recommend.,"Date of experience: October 14, 2022"
panaceafinancial.com,Brianna Capron,5,US,Taking out a loan as a graduating medical student,"As a 4th year medical student who just matched I was frantic about the costs of relocating for residency. Panacea has a quick and easy application and approved me for a PRN loan when many other services denied me, not understand the struggles of graduating medical students. I was provided with an amazing primary care banker who reached out to me via phone call and explained each step of the loan approval process. She continued to reach out each day letting me know where we were in the process and if there was anything else I needed to provide. Providing my banking information was secure and funds were deposited into my account within a week of applying. Taking out extra loans can be scary, especially on top of the high medical school loans students may already have, but working with Panacea has been worth it for the peace of mind and ability to be comfortable while transitioning to residency. I am so happy with my decision and would recommend this to any medical student looking for a transition to residency loan!","Date of experience: May 11, 2022"
panaceafinancial.com,Artem Shmelev,5,US,Fast and headache-free PRN loan?,Fast and headache-free PRN loan experience. Minimum documents and paperwork. Highly recommend for trainees.,"Date of experience: August 31, 2022"
panaceafinancial.com,Christina Chon,5,US,The best,The best! You can trust this company for sure.Thank you so much for helping me out,"Date of experience: October 25, 2022"
panaceafinancial.com,Alex R,5,US,Raquel was great!,Raquel was very prompt and helpful throughout the entire process! I appreciated her making this very easy and straightforward.,"Date of experience: April 12, 2022"
panaceafinancial.com,Yasser Martull,5,US,I will strongly recommend this company?,I will strongly recommend this company to all my peers. Excellent experience.Alex   thank you so much for your help.,"Date of experience: July 01, 2022"
