BankURL,UserName,ReviewRating,UserLocation,ReviewTitle,comments,ReviewDate
panaceafinancial.com,Kirby S.,5,US,Review after a little over one month of regular use,"I am a second year medical student and heard about Panacea while listening to the Short Coat podcast. I decided to try it out and was quite skeptical since it isn't one of the ""large banks,"" although it is a division of Primis Financial Corp. Here's what I think after regularly using Panacea for a little over one month.Pros:1. No fees associated with EFT (ACH transactions) and free transfers with Zelle: This is the main reason I opened an account since it allows me to send and receive funds between my trading accounts (crypto and stock) and bank account. My large bank charges $15 per transaction. Note: wire transfers still have a fee and the trading/crypto platform you use may still have a fee.2. Customer support: Amazing customer support! They always respond within 12 hours (even on the weekends) and are always so helpful. This is another one of the main reasons I switched, since they were always quick to answer any of my questions. I hope they continue this as they grow!3. Free nationwide ATM use: I was unfamiliar with this and got a little upset when I went to an ATM for the first time and was charged a $3.50 fee from the ATM I was using. I thought Panacea was using deceptive wording to make it seem like its free since they don't charge a fee and just left out that the ATM company will charge you. Thankfully, I was refunded the $3.50, but it took nearly 3 weeks to receive the refund.Cons:1. I have come across a few online purchases that would not accept the Panacea debit card: Although rare, it has occurred and if I switched to my large bank debit card the transaction would go through.2. The website and mobile app UI is not the greatest: Although simple to use for basic things like checking you transactions, it is not as friendly or organized (I feel) when trying to do things like finding and quickly copying your account/router #Overall, I love Panacea so far but I do not know if I am comfortable yet with fully switching. I think in the future I may but for now it's a great accessory account and I will most likely utilize their loan consolidation once I am a 4th year.","Date of experience: September 21, 2021"
panaceafinancial.com,Tahereh Orouji,5,US,My care banker is always available and?,My care banker is always available and answering all my questions. The documents were easy to provide which was so convenient. They are very fast. On the contract everything is clearly mentioned. I am really thankful to my care banker and the team.,"Date of experience: September 18, 2021"
panaceafinancial.com,Bassman Tappuni,5,US,Lifesaver,"My wife and I were both in tremendous credit card debt that resulted from residency applications, living years apart as residents, and we started to accumulate a lot of interest while we continue our training. We tried to look for options for physicians and stumbled upon Panacea. They were very kind to answer our questions and explain to us the process. Both Ned and Raquel were extremely helpful and informative and understanding of our situation. I will recommend Panacea for all healthcare physicians undergoing financial hardship as they are very efficient, understanding and have great interest rates that are impossible to find.","Date of experience: September 14, 2021"
panaceafinancial.com,Jeremy Mosher,5,US,Highly recommend,"Quick, easy, transparent, and professional. Highly recommend!","Date of experience: September 06, 2021"
panaceafinancial.com,Meredith Bradley,5,US,Super responsive,"The employees are great, EXTREMELY responsive and it seems like someone is there to get back to you all the time, even when you decide to rethink your financial life overnight on call!","Date of experience: September 04, 2021"
panaceafinancial.com,D T,5,US,Both the efficiency of the process and?,"Both the efficiency of the process and the quality of the personal service were unparalleled in my experience. Within a half-hour after I submitted the application I had a personal banker send me an email about the application (not a copy-paste pre-made email). On the same afternoon I had the money already deposited in my account. And interspersed throughout that small window of time I had several emails (again, personal emails) updating me on every stop of the process). Signing the note was all electronic. Interest rate was significantly lower than the two loans I consolidated with the money. The icing on the cake is that I'm paying interest-only until I finish residency, with no prepayment penalty so I can throw more at it during residency if I want, and then pay it off once I graduate. I've never been given so much financial breathing room with so little effort.","Date of experience: September 03, 2021"
panaceafinancial.com,Livpreet Singh,5,US,No Frills,"My partner used Raquel for his loan. As he said, she has been communicative and efficient when it came to getting documents submitted and updating us along the way. Great experience and would look here first for any future needs.","Date of experience: September 02, 2021"
panaceafinancial.com,Anthony Smith,5,US,The customer service was great and?,The customer service was great and provided the icing on the cake to what was a very seamless application process. As a resident I would recommend this service to those in need given certain financial circumstances.,"Date of experience: September 01, 2021"
panaceafinancial.com,Rachel Kpako,5,US,I sought out an MS4 loan for the?,"I sought out an MS4 loan for the stressful transition between the MS4 and residency period. It was a very smooth and efficient process. My banker, Mr. Beller, was present every step of the way keeping me updated and breast of the next steps. I would highly recommend this to any MS4 student who needs some money to help during this stressful period.","Date of experience: August 28, 2021"
panaceafinancial.com,AC Bahn,5,US,"Professional, Helpful, elevated: Great experience with Panacea","Great experience with Panacea. In medical school, I had applied for my first credit card (I know!) for residency  interviews and was rejected about 4 times. Since, I have been weary of applying for and dealing with banks. When in came to searching for loan at this time, I had the idea to google ??physician loan? because I had heard in past about certain companies that help physicians with home loans.   I needed a loan for that in between time of residency and attending while waiting for credentialing as well as some help re-strategizing my credit card to get my finances in healthier shape and on right track. I was attracted to Panacea because they looked at the whole picture and would would understand a physician debt:income ratio. My banker, Raquel Powers, was excellent and I would say immediate in getting back to me about questions, documents needed, etc. and was always informative on the next step or timelines which is helpful.I will return in the future and will recommend this to fellow residents.","Date of experience: August 26, 2021"
panaceafinancial.com,Melissa Wagner,5,US,Helpful and attentive.,,"Date of experience: August 25, 2021"
panaceafinancial.com,Awesome clicks,5,IN,Services,This bank services are extremely good . Their employer behaviour is also good.,"Date of experience: August 25, 2021"
panaceafinancial.com,Dr. Kim,5,US,Alex was great,Alex was great. I appreciate his enthusiasm when he called to assist me with the process. Clear terms. Quick disbursement of funds. Would recommend.,"Date of experience: August 24, 2021"
panaceafinancial.com,Brian Morgan,4,US,A fantastic organization,A fantastic organization! Great customer support from beginning to end of the process. The team are really informed and go the extra mile at every stage. I would recommend them unreservedly.,"Date of experience: August 19, 2021"
panaceafinancial.com,Saif Aslam,5,US,5* banking,I shall highly recommend them. They were very fast and easy to access. My primary banker Alex guided me through each step of the process and not to mention how fast they processed my application. The funds were available to me within minutes of approval.,"Date of experience: August 14, 2021"
panaceafinancial.com,Michael Mezzadri,5,US,Excellent experience with all?,Excellent experience with all individuals and processes.,"Date of experience: August 14, 2021"
panaceafinancial.com,MSIV Student,5,US,Medical Student,"Incredibly professional, kind and well informed. The staff quickly responded to my emails and were very willing to help with any questions I had. I would highly recommend this bank to any MSIV student who needs extra funds during this costly season of our career.","Date of experience: August 12, 2021"
panaceafinancial.com,Adam Sullivan,5,US,Great and Easy to Work With,Parker at Panacea Financial was great to work with and we had a great experience from start to finish.,"Date of experience: August 12, 2021"
panaceafinancial.com,Rodney Clarke,5,US,My experience with Alex??s assistance?,My experience with Alex??s assistance was awesome.I couldn??t have done it this quickly without his help.I will be looking for him when I want do any other transaction at Panacea Financial.,"Date of experience: August 10, 2021"
panaceafinancial.com,Ahmad Dhodi,5,US,Review of Parker Beller,"Parker provided me with a great experience. Parker??s service was judgement free, objective, and very attentive. I definitely felt comfortable giving Parker a call at any time to talk about any progress or any hold ups. He was also very resourceful, he did his own research to provide me with a good description of what i need to produce for him. Overall a great experience in every regard.","Date of experience: August 06, 2021"
panaceafinancial.com,Brian,5,US,I have never regretted that I used the?,I have never regretted that I used the services of Panacea Financial,"Date of experience: July 30, 2021"
panaceafinancial.com,Ayorinde Soipe,5,US,Awesome experience?,I applied for a loan with Panacea and it was approved at a time that meets my needs perfectly!. I am grateful for the wonderful team members that helped me navigate the application process.,"Date of experience: July 29, 2021"
panaceafinancial.com,BC,5,US,Recommend to classmates,"Panacea is a treasure that makes borrowing for the residency process so easy! I was incredibly impressed with how quickly and easily the process went. The person who worked with me, Alex, was very helpful and pushed things along effectively. I would recommend Panacea to all of my med school classmates.","Date of experience: July 28, 2021"
panaceafinancial.com,AR,5,US,Banking for physicians by physicians,"I like that this bank is by physicians for physicians. As a resident doctor they were extremely helpful in getting me the best rate possible for a debt consolidation loan, customer service was very helpful and fast. I would definitely recommend them and will use them again in the future for business.","Date of experience: July 27, 2021"
panaceafinancial.com,B. Cabrera,5,US,Panacea was & continues to be the VIP?,"Panacea was & continues to be the VIP bank we as physicians deserve. Their service is unmatched by any financial institution I've worked with before. Undoubtedly heaven-sent during my transition into PGY1, the personal banker they assign you is there every step of the way, via text, calls or email; no more being placed on hold or press ""2"" for this etc.  It is an absolute pleasure interacting with the entire team & I was able to pay for my furniture, movers and 1st month expenses because of their quick & simple loan process. They took all of the financial stress out of my first month of intern year. I switched all my accounts to Panacea!","Date of experience: July 26, 2021"
panaceafinancial.com,tayo akadiri,5,US,Alex was very helpful throughout the?,"Alex was very helpful throughout the process, Informing me in real time about my updates. Process was very smooth and I received my money in 48 hours.","Date of experience: July 23, 2021"
panaceafinancial.com,Simon,5,US,The entire loan process was streamlined?,The entire loan process was streamlined and hassle free with excellent personal banker support. Only wished I learned about this earlier!,"Date of experience: July 23, 2021"
panaceafinancial.com,AA,5,US,Panacea Financial is great!,Panacea Financial is great. Having had to move to a new state for residency had a lot of credit card debt that I was able to consolidate and save compared to making the minimum payments on my credit cards,"Date of experience: July 21, 2021"
panaceafinancial.com,Theresa Emeli,5,US,Great,Great! Would bank with them again. Very punctual and answered all of my questions. They were a pleasure to work with!,"Date of experience: July 21, 2021"
panaceafinancial.com,Abrahan Lara,5,US,Amazing and friendly customer service,"Amazing and friendly customer service! As a resident physician, I was in need of a personal loan. The rates were appropriate and the time it took to get approved was unimaginably quick.","Date of experience: July 20, 2021"
panaceafinancial.com,Sarthi Dalal,5,US,A wonderful experience,"A wonderful experience. So quick, kind, and streamlined. They worked with me through every step and I got my funding in less than 4 business days. Highly recommend Panacea, especially for doctors!","Date of experience: July 19, 2021"
panaceafinancial.com,Patrick,5,US,Excellent and helpful service,"Excellent and helpful service, very personable staff, made the loan application process easy","Date of experience: July 19, 2021"
panaceafinancial.com,Steven Thebaud,5,US,Great experience,"Great experience. The members of Panacea were very helpful, fast and efficient at helping me obtain personal loan.","Date of experience: July 15, 2021"
panaceafinancial.com,Camille,5,US,Customer-centered care!,My primary care banker has been so responsive and helpful from the very beginning. Very excited to bank with such a supportive and customer-centered institution!,"Date of experience: July 14, 2021"
panaceafinancial.com,Dr JAM,5,US,Financial savior,"I??m a resident with two kids. Cost of childcare and other expenses made it impossible to complete my residency without extra financial help. Moonlighting was not an option for me. I could not qualify for personal loans due to my debt to income ratio from student loans. Panacea was able to look past that and approved my loan. The entire process was seamless, quick, and transparent. Communication was prompt and personal with phone calls and emails. They respect my time and value as a physician. I would recommend their services to anyone!","Date of experience: July 14, 2021"
panaceafinancial.com,william moffat,5,US,Great and wonderful customer service,Great and wonderful customer service.  Extremely helpful and pleasant to work with.,"Date of experience: July 12, 2021"
panaceafinancial.com,SV,5,US,Easy loan?,It was super easy and a breeze to get my loan. Everyone was friendly and able to answer my questions. My loan was approved in few days.,"Date of experience: July 09, 2021"
panaceafinancial.com,Patrick Owens,5,US,A bank worth talking about,"This is an amazing concept. I was able to have a savings account opened in a few minutes with a rate that beats Ally. Their 24/7 customer service has been very pleasant and helpful, and I appreciate being able to talk to someone immediately when it??s convenient around my schedule. Would recommend to any physician.","Date of experience: July 09, 2021"
panaceafinancial.com,T N,5,US,Creative financial package offerings,"Creative financial package offerings.  Excellent customer service with very fast turn around time.  This organization is not predatory and works hard to support Physician interests. Ned Palmer, MD one of the co-founders personally reached out on Holiday weekend. Really tough to find that kind of sincerity in business these days.","Date of experience: July 09, 2021"
panaceafinancial.com,Kristy parthishea,5,US,Panacea Financial was really helpful in?,Panacea Financial was really helpful in getting my accounts set up. Parker was especially very patient and kind while dealing with my case. Would 100% recommend them especially for those in the medical field.,"Date of experience: July 05, 2021"
panaceafinancial.com,Jasmine Campbell,5,US,Great service,Parker was great! Very professional and efficient. The process was smooth and easy!,"Date of experience: July 02, 2021"
panaceafinancial.com,Do Brown Sus,5,US,Loan approval was quick,"Loan approval was quick, seamless. Not a single complaint.","Date of experience: July 01, 2021"
panaceafinancial.com,Nathan Radakovich,5,US,Easy to set up the loan,"Easy to set up the loan, helpful to chat with a real person and straightforward.","Date of experience: June 30, 2021"
panaceafinancial.com,Nicolae Torres,5,US,Physician Loan,"From talking to Raquel to getting my loan approved, this institution deserves a 5 star rating!!!","Date of experience: June 29, 2021"
panaceafinancial.com,Jill,5,US,Panacea was super easy and responsive?,Panacea was super easy and responsive to work with and I so greatly appreciated them taking the time to walk me through all the numbers.  They were very understanding of my odd hours as a physician and my schedule.  I would highly recommend them for student loan refinance or the PRN or even medical practice loan.  They have a lot of experience to guide you to the right product for you.,"Date of experience: June 29, 2021"
panaceafinancial.com,Nami Moradi,5,US,Excellent customer service,Excellent customer service. I would recommend to my colleagues,"Date of experience: June 26, 2021"
panaceafinancial.com,customer,5,US,My Banker is Awesome,"My personal bank person was so helpful in guiding me through the processes. He's approachable when I have questions and prompt to respond. Thanks, everyone!","Date of experience: June 24, 2021"
panaceafinancial.com,Jacob,5,US,Worked with Alex to secure a personal?,Worked with Alex to secure a personal loan and the process was very smooth.  Funds were quickly added to my account!,"Date of experience: June 17, 2021"
panaceafinancial.com,Tyler Adamson,5,US,Raquel for the win,"The process to complete the application is as quick as advertised. There is continual outreach throughout the process. I will say that the review process took longer than expected because there was miscommunication between the general email correspondence and my individual loan concierge. Despite those, my concierge Raquel was attentive and worked closely to get everything settled within 24hrs. Funds were dispersed quickly. Overall, fairly expedited process with great service.","Date of experience: June 15, 2021"
panaceafinancial.com,Marguerite Youngren,5,US,Great service,"Great service, very helpful!","Date of experience: June 14, 2021"
panaceafinancial.com,Ernesto Zamora,5,US,The easiest and most transparent loan?,The easiest and most transparent loan application I have ever done. It feels nice to work with a financial institution that understands Doctor's specific needs and circumstances. Awesome costumer service.,"Date of experience: June 11, 2021"
panaceafinancial.com,Sundeep Mummaneni,5,US,Raquel has been amazing!,Raquel has been amazing and helpful!  She has gone above and beyond the regular job description and is an excellent representative of your company!,"Date of experience: June 11, 2021"
panaceafinancial.com,Alysia Johnson,5,US,Trustworthy with low APR,The process was quick and easy. They worked in a very trustworthy manner and the interest rate is MUCH LOWER THAN ANY OTHER LOAN I WAS OFFERED.,"Date of experience: June 10, 2021"
panaceafinancial.com,Aisha Rahim,5,US,Great service for the physicians by the?,Great service for the physicians by the physicians. Got my loan approved in 3 business days which is amazing! I don??t think you can get that service any where.Alex made sure that timely delivery of the funds was possible. Amazing work and recommend to every physician!!,"Date of experience: June 10, 2021"
panaceafinancial.com,Abir Hossain,5,US,Excellent!,"Alex was excellent and thorough. He was helpful and very open, excellent customer service.","Date of experience: June 07, 2021"
panaceafinancial.com,Mohamed Eslam,5,US,the right bank for a doctor,"I worked with Parker who was my primary care banker. Parker was an example of what anyone would need in a banker. He was responsive, helpful, answered questions and worked with me as I changed my mind and had questions. Available all the time and even anticipated my needs and helped me make the right choices. Parker and Panacea seem to understand what it is like to be a physician and they work hard to make my experience take as little time and navigation as possible. I never had to spend more than a few minutes clicking away on what Parker prepared for me without making me go to a physical location or spend 2 hours on the phone.","Date of experience: June 02, 2021"
panaceafinancial.com,Maggie,5,US,"Quick process, friendly and helpful","Raquel Powers was very helpful, answered all of our questions, even on weekends, and was super nice. We were approved quickly and recieved our funds quickly as well.","Date of experience: June 01, 2021"
panaceafinancial.com,Abby Richardson,5,US,I appreciated the help of my personal?,I appreciated the help of my personal banker who was available to walk me through any questions I had.,"Date of experience: May 29, 2021"
panaceafinancial.com,Ali Parsaeian,5,US,Ali P. MD,This was one of the best customer service experience I??ve ever had .The process was very easy and whole transaction was smooth and outstanding. I will continue an ongoing relationship..,"Date of experience: May 28, 2021"
panaceafinancial.com,Bettie Yeboah,5,US,Awesome service,Alex and the rest of their team have been so responsive and attentive to me as a MS4 and now a resident physician. The process of getting funds was extremely easy and I??ve recommended them to many of my classmates,"Date of experience: May 26, 2021"
panaceafinancial.com,Mohammad Ali Alkheder,5,US,Awesome service,"Awesome service, fast response, clear terms?  clear instructions, and fast decision making, I've never had better banking or financing experience so far, I am glad I knew panacea financial and I hope they be able to help more physicians and medical students.","Date of experience: May 25, 2021"
panaceafinancial.com,Lauren Miller,5,US,Easy to work with and very responsive.,,"Date of experience: May 17, 2021"
panaceafinancial.com,Leland C. McCluskey Jr.,5,US,These guys get it,"These guys get it. They understand the unique financial situation that medical students, residents, fellows, and attending physicians are in and they work to meet our unique financial needs.  I have been very impressed with the products they offer, the customer service, and prompt return of emails and phone calls.  100% would recommend to my colleagues.","Date of experience: May 14, 2021"
panaceafinancial.com,Rose Joachim,5,US,I learned about Panacea from a fellow?,I learned about Panacea from a fellow med student and I have to say it was the best experience and definitely the right way to go about getting financial help with moving for residency. Parker Beller was the one that helped me and everything went smoothly and fast with him guiding me. Got approved within 24 hrs! I'll be sure to recommend Panacea to others!,"Date of experience: May 12, 2021"
panaceafinancial.com,MalR,5,US,I had the best loan service,I had the best loan service. I went to many so called physician loan service providers such as BHG etc but they all had rates close to credit card APR. Panacea gave me the best rate and timely service. I am very pleased with the personal loan I received from Panacea. Raquel was very professional.,"Date of experience: May 10, 2021"
panaceafinancial.com,Tyler Briley,5,US,Great customer service,Great customer service! Simply process. Swift transfer of funds.,"Date of experience: May 10, 2021"
panaceafinancial.com,Rolanda Willacy,5,US,My experience with Panacea Financial?,"My experience with Panacea Financial was top notch! I received guidance every step of the way and had a particularly wonderful experience working with Alex to secure the Resident Loan! I am incredibly grateful for this opportunity and I look forward to a continued partnership with this incredible company. I would absolutely recommend Panacea financial for Medical Students, Residents and Attendings!","Date of experience: May 09, 2021"
panaceafinancial.com,Lydia Somi Park,5,US,very timley and personal details and?,very timley and personal details and excellent customer service,"Date of experience: May 07, 2021"
panaceafinancial.com,J Bailey,5,US,New member,So far I've had a great experience with Panacea and their staff.,"Date of experience: May 05, 2021"
panaceafinancial.com,Okenwa Okose,5,US,Perfect Service,,"Date of experience: May 05, 2021"
panaceafinancial.com,Brian Day,5,US,Excellent Service,"As a 4th year medical student low on funds and needing to move to another state for residency, Alex came to the rescue. The process to get a PRN loan was quick and painless, and Alex was extremely professional. If you have matched and are in need of some extra funds prior to residency, I would highly suggest working with Panacea Financial.","Date of experience: May 03, 2021"
panaceafinancial.com,E.J.,5,US,Thank You Panacea Financial,"Working with Panacea Financial to secure a loan during the transition from medical school to residency was incredibly pleasant and straightforward. They made me feel as though my needs were prioritized, and I am forever grateful.","Date of experience: April 27, 2021"
